,Tag,Title,Content
16,Thể thao,Venus Williams dự Wimbledon ở tuổi 43,"Venus Williams từng bảy lần vô địch Grand Slam ở nội dung đơn nữ và 14 lần đăng quang ở nội dung đôi nữ. Tại Wimbledon, cô chị nhà Williams có 11 danh hiệu, trong đó có năm chức vô địch đơn nữ. Venus được biết đến là tay vợt có lối đánh giàu sức mạnh, với ưu điểm là khả năng tấn công bóng bạt ở cả cú thuận và cú trái. Sau nửa năm nghỉ thi đấu vì chấn thương gân kheo, tay vợt Mỹ hiện xếp thứ 697 thế giới. Cô là một trong bảy tay vợt nhận suất đặc cách ở nội dung đơn nữ Wimbledon 2023, bên cạnh Elina Svitolina và năm tay vợt chủ nhà. Hồi đầu tuần, Venus Williams gây ấn tượng mạnh khi đánh bại tay vợt số 48 thế giới Camila Giorgi sau ba set ở giải WTA tại Nottingham. Đó là chiến thắng đầu tiên của Venus trước một đối thủ top 50 sau gần bốn năm. Tay vợt 43 tuổi sau đó thua Jelena Ostapenko cũng sau ba set tại vòng hai. Trong lần gần nhất tham dự nội dung đơn nữ tại Grand Slam sân cỏ, Venus Williams thua Ons Jabeur ở vòng hai năm 2021. Năm ngoái, cô chỉ tham gia đánh đôi do không có thể trạng tốt nhất. Cô em của Venus, Serena Williams thì giải nghệ sau khi thua ở vòng đầu nội dung đơn nữ năm 2022. Trong sự nghiệp, Serena giành tổng cộng 23 Grand Slam đơn nữ, trong đó có bảy danh hiệu Wimbledon. Thành tích này chỉ kém một Grand Slam so với kỷ lục của cựu tay vợt nữ Margaret Court. Truyền thông bày tỏ ý kiến trái chiều về quyết định trao vé đặc cách cho Venus Williams của ban tổ chức Wimbledon. Trên mạng xã hội Twitter, nhiều người cho rằng việc Venus được dự giải ở tuổi 43 với thứ bậc 697 thế giới làm mất đi cơ hội của các tay vợt xếp trên. Dẫu vậy, nhiều cựu tay vợt cho rằng sự có mặt của Venus Williams khiến giải đấu có thêm sức hút, đặc biệt ở nội dung đơn nữ vốn không nhận được nhiều sự quan tâm như đơn nam. Vy Anh"
17,Thể thao,"Medvedev: 'Federer, Djokovic là người ngoài hành tinh'","Sau khi chật vật qua vòng hai giải Halle Mở rộng, sự kiện sân cỏ khởi động cho Wimbledon, Medvedev thừa nhận bản thân vật lộn với bề mặt sân này. Anh nói: ""Bề mặt này thực sự quá khó với tôi. Bạn có thể chơi tốt nhưng vẫn sẽ thua tie-break. Điều này thực sự kỳ lạ với tôi"". Medvedev thua 5-7 trong loạt tie-break set hai với Laslo Djere dù sở hữu cú giao bóng lợi hại bậc nhất ATP. Anh sau đó thắng set ba 6-3 để vào tứ kết gặp Roberto Bautista Agut. ""Khi nhìn Federer và Djokovic chơi trên mặt sân này, tôi cảm thấy họ như người ngoài hành tinh"", Medvedev nói thêm. ""Cách họ di chuyển và xử lý tình huống là độc nhất. Ở bề mặt này, một tay vợt hàng đầu có thể thua bất kỳ ai. Nhưng Federer và Djokovic vô địch rất nhiều"". Medvedev cho biết anh cố xem nhiều trận của Federer và Djokovic để học hỏi. Tay vợt Nga đã có 20 danh hiệu ATP Tour nhưng chỉ một lần vô địch sân cỏ, tại Mallorca năm 2021. Medvedev năm ngoái cũng chơi tốt ở Halle Mở rộng, vào chung kết thua Hubert Hurkacz. Federer và Djokovic là hai người thành công nhất ở Wimbledon với lần lượt tám và bảy lần vô địch. Federer còn giữ kỷ lục 10 lần đoạt Halle Mở rộng – nơi anh trở lại đầu tuần này trong buổi lễ tri ân của ban tổ chức. Medvedev là hạt giống số một Halle Mở rộng năm nay. Những hạt giống hàng đầu khác ở tứ kết là Andrey Rublev, Jannik Sinner và Alexander Zverev. Sau giải này, các tay vợt còn hai sự kiện ATP 250 ở Mallorca và Eastbourne để chuẩn bị cho Wimbledon khởi tranh vào 3/7. Vy Anh"
18,Thể thao,Quang Hải: 'Gia nhập CAHN là trang mới trong sự nghiệp',"""Tôi rất vui và hạnh phúc khi gia nhập CAHN, xem đây như trang mới trong sự nghiệp"", Quang Hải nói. ""Tôi sẽ nỗ lực, cống hiến bằng tất cả những gì tốt nhất cho CLB"". Tiền vệ 26 tuổi cho biết anh nóng lòng được tập luyện cùng các đồng đội, chuẩn bị cho các trận đấu sắp tới, muốn đóng góp nhiều nhất và cùng CLB chiến thắng. Phó Chủ tịch CLB CAHN Trần Văn Hùng hy vọng Quang Hải sớm hòa nhập với lối chơi chung, cam kết tạo mọi điều kiện để tiền vệ người Hà Nội sớm thích nghi và cùng hướng tới đỉnh cao mới. Lễ ra mắt Quang Hải dự kiến diễn ra lúc 9h30, nhưng bị hoãn đến 12h mới có thể bắt đầu vì lý do kỹ thuật. Quang Hải có mặt tại trụ sở đội bóng tại quận Hoàn Kiếm cùng bạn gái Chu Thanh Huyền và người đại diện. Quang Hải ký hợp đồng có thời hạn 18 tháng, nhận mức lương tháng hơn 100 triệu đồng. CAHN là CLB Việt Nam thứ hai tiền vệ này thi đấu, sau Hà Nội FC - nơi anh bốn lần vô địch V-League, đoạt hai Cup Quốc gia và ba Siêu Cup Quốc gia. Chiều nay, Quang Hải sẽ tập buổi đầu tiên cùng CLB. CAHN sẽ chạm trán Hà Tĩnh ở vòng 12 V-League 2023 ngày 24/6, nhưng nhiều khả năng tân binh này chỉ góp mặt để ra mắt cổ động viên. Quang Hải là một trong những cầu thủ thành công nhất của Việt Nam. Năm ngoái, anh từ chối gia hạn với CLB Hà Nội để chuyển sang Pháp thi đấu cho Pau FC ở Ligue 2. Nhưng mọi chuyện không suôn sẻ. Cả mùa, Quang Hải chỉ đá 13 trận, với 268 phút - trung bình 20,6 phút mỗi trận, ghi một bàn. Lần gần nhất anh ra sân cho đội một là 10 phút cuối trận Pau FC thua 0-1 Laval ngày 18/2 tại Ligue 2. Sau đó, tiền vệ 26 tuổi chơi bảy trận với 579 phút cho Pau B tại National 3 - giải hạng năm Pháp. Cuối tháng 5, anh xin thanh lý hợp đồng sớm một năm và được Pau FC chấp thuận. Ở đợt tập trung đội tuyển Việt Nam tháng 6/2023, Quang Hải đá trọn trận gặp Hong Kong ngày 15/6 và được HLV Philippe Troussier đánh giá cao về cường độ hoạt động. Ở trận kế sau gặp Syria tại Nam Định, Quang Hải đá 84 phút và tiếp tục gây ấn tượng tích cực, đóng góp nhiều vào lối chơi tập thể của đội chủ nhà. Việt Nam đều thắng hai trận này với tỷ số 1-0. Hiếu Lương"
19,Thể thao,Mourinho bỏ Hội đồng Bóng đá UEFA,"""Gửi ông Boban, cảm ơn ông đã vì đã mời tôi tiếp tục tham gia Hội đồng Bóng đá UEFA, nhưng tôi rất tiếc phải báo tin cho ông rằng tôi sẽ rời nhóm này ngay lập tức"", Mourinho viết trong email gửi giám đốc bóng đá UEFA. ""Tôi đã rất tin tưởng vào nhóm này lúc gia nhập, nhưng giờ thì không, nên tôi phải quyết định. Tôi chân thành nhờ ông báo quyết định này cho chủ tịch Aleksandar Ceferin"". Mourinho ra quyết định chỉ một ngày sau khi nhận án cấm chỉ đạo bốn trận ở các giải UEFA, vì có ""phát ngôn xúc phạm, lăng mạ trọng tài"" Anthony Taylor sau trận chung kết Europa League ngày 31/5/2023. Ông Taylor gây nhiều tranh cãi với các quyết định trong trận, khi Roma thua Sevilla ở loạt sút luân lưu. Sau đó, Mourinho theo Taylor đến bãi đỗ xe để chửi mắng và dùng những ngôn từ lăng mạ trọng tài người Anh. Mourinho cũng từng nhiều lần chê trách ông Taylor thời còn dẫn các CLB Anh như Chelsea, Man Utd hay Tottenham. Trong mùa 2022-2023, HLV người Bồ Đào Nha còn hai lần bị cấm chỉ đạo ở Italy đều vì những sự cố liên quan đến trọng tài. Hội đồng Bóng đá UEFA là ý tưởng của Boban và chủ tịch Hội đồng Trọng tài UEFA Roberto Rosetti. Hội đồng Bóng đá mời những danh thủ và HLV tham dự, họp mặt ở Nyon, Thụy Sĩ thường niên. Họ sẽ thảo luận và đề xuất những ý tưởng để cải thiện bóng đá hay UEFA. Lần gần nhất Hội đồng này họp là ngày 24/4/2023, với 24 thành viên, trong đó có những HLV nổi tiếng như Mourinho, Zinedine Zidane, Carlo Ancelotti hay Fabio Capello. Hoàng An"
20,Thể thao,Nghi vấn Arab Saudi rót tiền cứu Chelsea,"Tiền vệ N'Golo Kante đã gia nhập Al Ittihad. Thủ môn Edouard Mendy, trung vệ Kalidou Koulibaly và tiền vệ Hakim Ziyech cũng đạt thỏa thuận gia nhập một CLB ở Saudi League. Tiền vệ Callum Hudson-Odoi, tiền đạo Pierre-Emerick Aubameyang và trung phong Romelu Lukaku cũng nhiều khả năng rời Chelsea để tới Arab Saudi. Dự kiến sẽ có bảy cầu thủ chuyển nhượng giữa Chelsea và Saudi League trong hè 2023, và điều này khó có thể là ngẫu nhiên. ""Ngoại hạng Anh cần phải cấm các đội chuyển nhượng cầu thủ tới Arab Saudi để đảm bảo tính toàn vẹn của giải"", cựu hậu vệ Gary Neville nói với BBC. ""Họ cần kiểm tra các giao dịch có hợp lệ không, trước khi thông qua thương vụ. Nếu nhìn vào cơ cấu sở hữu Chelsea, tôi tin rằng các giao dịch nên dừng lại"". Chelsea đang bị tố lách luật Công bằng Tài chính, với những thương vụ nói trên. Trong mùa 2021-2022, họ có lợi nhuận âm 154 triệu USD. Còn ở mùa trước đó, đội bóng lỗ tới 195 triệu USD. CLB thành London có thể tiếp tục thua lỗ ở mùa 2022-2023, khi tình hình tài chính báo động. Quỹ Đầu tư Công Arab Saudi (PIF) gần đây mua lại phần lớn cổ phần của bốn đội hàng đầu giải, gồm Al Ittihad, Al Nassr, Al Hilal và Al Ahli. Họ cũng đã đầu tư vào Quỹ Clearlake - chủ sở hữu chính của Chelsea. PIF cũng kết nối với tỷ phú Todd Boehly - đồng sở hữu Chelsea - để đầu tư vào một chuỗi khách sạn. Chelsea đang gấp rút bán cầu thủ hưởng lương cao, thanh lọc đội hình sau một mùa giải họ đã chi tới 672 triệu USD chiêu mộ tân binh. Còn bên mua dường như có túi tiền không đáy, muốn thu hút những ngôi sao về Saudi League, đồng thời có quan hệ với bên bán. Họ dường như dùng tay này để rửa tay kia. ""Đây là một phần vấn đề với các quỹ đầu tư"", chuyên gia tài chính thể thao Christina Philippou từ Đại học Portsmouth nói. ""Xung đột lợi ích là vấn đề trong phần lớn ngành công nghiệp, vì thế các bên phải khai báo minh bạch thông tin sở hữu. Vì thế, các CLB bóng đá cũng cần tuyên bố danh sách chủ sở hữu để đưa thông tin vào Sách Trắng về bóng đá"". Theo cấu trúc đội bóng do Chelsea công bố, Boehly và các nhà đầu tư khác, cùng những lãnh đạo Clearlake như Behdad Eghbali và Jose Feliciano nằm trong danh sách cổ đông. Công ty sở hữu Chelsea có tên là Blues Partners Limited, liên doanh giữa Boehly và hai thành viên Clearlake. Clearlake góp 60% trong khoản tiền 3,2 tỷ USD mua lại Chelsea. Đến đây chưa có vấn đề gì. Điều gây tranh cãi nằm ở chỗ Clearlake lấy tiền từ đâu để đầu tư. PIF thành lập năm 1971, đã đầu tư vào những nguồn nguyên liệu hóa thạch ở Trung Đông. Năm 2014, chính phủ Saudi cho phép PIF đầu tư vào các công ty nước ngoài. Một năm sau, Hoàng tử Saudi Mohammed bin Salman (MBS), sau này trở thành Thái tử, được giao nhiệm vụ quản lý PIF. Quỹ này đóng vai trò quan trọng giúp MBS khẳng định vị thế, thông qua chính sách đa dạng hóa, hiện đại hóa kinh tế Saudi. Dưới trướng MBS, PIF phát triển mạnh về tầm vóc, và thể thao là một phần quan trọng của danh mục đầu tư. Ví dụ năm 2021, PIF mua lại 80% cổ phần của Newcastle. Clearlake có trụ sở ở ngoại ô Los Angeles, được Eghbali, Feliciano và đối tác cũ Steven Chang sáng lập năm 2006, tập trung vào các danh mục như hàng hóa tiêu dùng, công nghệ và công nghiệp. Trong 10 năm qua, Clearlake trở thành quỹ đầu tư hiệu quả bậc nhất cho những công ty cỡ vừa tại Mỹ. Quỹ này mượn khoảng hai phần ba số tiền để mua lại các doanh nghiệp, lên chiến lược vận hành để phát triển rồi bán lại sau vài năm để lấy lãi. Chiến lược của Clearlake hiệu quả, khi họ đã đầu tư vào khoảng 450 doanh nghiệp trong 17 năm vận hành, hiện quản lý số tài sản lên tới 75 tỷ USD. Khi Eghbali và Feliciano bán 20% cổ phần Clearlake cho ba quỹ đầu tư khác năm 2018, công ty của họ được định giá 4 tỷ USD. Nhưng nó đã phát triển nhanh kể từ đó. Các nhà đầu tư cho Clearlake gồm 300 cá nhân, tổ chức, ngân hàng, các công ty bảo hiểm hay quỹ đầu tư quốc gia từ 40 nước trên thế giới. Theo Clearlake, không nhà đầu tư nào của họ cấp vốn quá 5% cho một dự án. Và trung bình một nhà đầu tư không được góp vốn quá 1% cho dự án. Điều này có nghĩa nếu đầu tư vào Chelsea, cổ phần của PIF ở đội bóng sẽ không quá 5%. Gần như chắc chắn PIF đầu tư vào Clearlake. Nhưng liệu PIF có sẵn sàng trả Chelsea 100 triệu USD cho những cầu thủ chỉ đáng giá 50 triệu, để đội bóng lách luật không? Theo một cố vấn bóng đá tên Jordan Gardner, Clearlake hoạt động hiệu quả đến nỗi bất cứ ai đầu tư vào họ đều hài lòng. Những quỹ lớn trên thế giới như Clearlake đều có những cổ đông chính là quỹ đầu tư công, từ Australia, đến Canada, UAE hay Arab Saudi, và các tỷ phú thuộc nhóm giàu nhất. ""Vì thế PIF đầu tư vào Clearlake là bình thường và không có xung đột lợi ích nào"", Gardner nhấn mạnh. Giới học thuật cũng có quan điểm tương tự. Tiến sĩ, chuyên gia vùng Trung Đông Christopher Davidson cho rằng các cáo buộc không đúng với phương thức hoạt động của PIF. ""Các quỹ đầu tư Công của Qatar có thiên hướng mạo hiểm hơn khi đổ tiền nhiều vào nhiều quỹ tư nhân của Mỹ. Còn PIF truyền thống và an toàn hơn khi tập trung vào những tập đoàn lớn của phương Tây hay bất động sản Anh"", Davidson nói. Philippou cho rằng vấn đề ở Chelsea hiện có thể gặp phải tại bất cứ đội bóng lớn nào. Bởi họ trả quá nhiều tiền cho cầu thủ, khiến những đội nhỏ hơn không thể mua hàng thanh lý từ đội mạnh. Nhưng Arab Saudi tuyên bố họ sẵn sàng tuyển mộ những ngôi sao, vì thế Chelsea không ngại đàm phán với họ. Chelsea và Clearlake khẳng định PIF không liên quan gì đến đội bóng này. Theo quy định Ngoại hạng Anh, mọi giao dịch trên 1 triệu bảng (1,28 triệu USD) cần được ban tổ chức kiểm tra để đề phòng chúng vượt quá giá trị trường. Vì thế ban tổ chức có quyền ngăn cản thương vụ nếu họ chứng minh được giá chuyển nhượng cao vô lý. Hiện vẫn chưa có lý do để kết luận liệu Chelsea có đang lách luật hay không. Nhưng dù thế nào đội bóng này cũng đã tìm được phao cứu sinh sau một mùa giải thảm họa từ trong đến ngoài sân cỏ. Xuân Bình (theo Athletic)"
21,Thể thao,Cầu thủ Ngoại hạng Anh phải tuân thủ những gì,"Tiến sĩ Mark Gillett, 53 tuổi, cố vấn y tế của Ngoại hạng Anh từ năm 2018, nói với tờ Telegraph rằng tinh thần thể thao của các cầu thủ Ngoại hạng Anh giờ khác xa ""nhiều năm ánh sáng"" so với trước đây, nhờ những tiến bộ của khoa học. Trong đó, vấn đề dinh dưỡng được coi trọng. ""Phục hồi sau trận đấu rất quan trọng"", Gillett giải thích. ""Tiếp nhiên liệu càng sớm càng tốt. Đồ ăn trong phòng thay đồ, đồ uống cá nhân. Một số dạng bọc protein - gà hoặc đồ thuần chay. Đồ uống với chất điện giải. Đôi khi họ có thể cần một chiếc pizza. Đặc biệt là khi họ thường ăn kiêng thực sự nghiêm ngặt trong nhiều tuần liền. Nhưng đã có một bước tiến lớn đối với thực phẩm nguyên chất hơn là thực phẩm bổ sung"". Gillett tiết lộ thêm rằng các cầu thủ sẽ có bữa ăn khi trở lại xe bus sau trận, với sushi, hoặc thịt ""chất lượng cao"" với một ít mì ống. Theo vị chuyên gia này, đây là một biện pháp hiệu quả để đối phó với tình trạng quá tải của cầu thủ sau khi thi đấu. Nhưng dinh dưỡng chỉ là một phần của phân tích rộng lớn hơn nhiều về sức khỏe, thể lực và phong độ của cầu thủ. Gillett rất coi trọng tầm quan trọng của ""vệ sinh giấc ngủ"", với một số CLB thậm chí còn lắp đặt những chiếc đệm được thiết kế đặc biệt trong nhà của các cầu thủ để họ làm quen trước những chuyến đi xa qua đêm. Gillett giải thích rằng việc giảm thời gian sử dụng điện thoại và máy tính xách tay trong một giờ trước khi ngủ là rất quan trọng, trong khi ""đèn xanh"" lại rất quan trọng với các cầu thủ. Nhiều ngôi sao Ngoại hạng Anh đeo kính ánh sáng xanh vào ban đêm để chặn các tia từ các thiết bị điện tử có thể gây mất ngủ. ""Chúng tôi làm việc với từng cầu thủ"", Gillett nói thêm. ""Có những chuyên gia về giấc ngủ làm việc với từng cầu thủ. Bạn không muốn sử dụng các thiết bị theo dõi cho bạn biết khi nào các cầu thủ bắt đầu lo lắng về điều đó. Quan trọng hơn là về trực giác và ý thức chung"". Gillett cũng không muốn các cầu thủ xem nhẹ việc tắm nước đá - một cách giải tỏa mệt mỏi hiệu quả sau trận đấu căng thẳng. Cách làm này giúp phục hồi cơ bắp nhanh chóng và Gillett khuyên các cầu thủ nên mặc quần bó trong nước đá. Bất chấp chất lượng được thể hiện ở các trận Ngoại hạng Anh, Gillett vẫn cho rằng giải đấu vẫn còn rất xa mới đạt mức trần về mức độ thể trạng của các cầu thủ. Hồng Duy (theo Sport Mail)"
22,Thể thao,Neymar ủng hộ Ancelotti dẫn dắt Brazil,"""Ancelotti đã giành được mọi danh hiệu trong sự nghiệp cầm quân. Tôi tin chắc ông ấy sẽ dạy cho các cầu thủ nhiều thứ"", Neymar nói ngày 22/6, khi tham gia một sự kiện do quỹ từ thiện đứng tên anh tổ chức. Hôm 18/6, Chủ tịch Liên đoàn bóng đá Brazil (CBF) Ednaldo Rodrigues khẳng định Ancelotti sẽ chuyển sang dẫn dắt tuyển Brazil ngay sau khi hết hạn hợp đồng với Real Madrid vào ngày 1/7/2024. Brazil chưa có HLV chính thức sau khi Tite từ chức vào tháng 12 năm ngoái vì thất bại ở World Cup 2022. Hiện, đội tuyển xứ Samba được dẫn dắt bởi cựu tuyển thủ Ramon Menezes trên tư cách tạm quyền. Tại Real, Ancelotti đang chỉ dạy ba tuyển thủ Brazil, gồm hai tiền đạo Rodrygo, Vinicius Junior và trung vệ Eder Militao. Góp mặt trong buổi lễ do Neymar tổ chức, Rodrygo từ chối bình luận do chưa có thông tin xác thực. Nhưng tiền đạo 22 tuổi thừa nhận: ""Ông ấy là phương án A của tuyển Brazil. Chủ tịch CBF tin tưởng ông ấy và chúng tôi cũng vậy. Với tôi, Vini và Militao, chúng tôi biết ông ấy tại Real Madrid và hiểu Ancelotti vĩ đại như thế nào"". Đã hơn 50 năm kể từ khi Brazil được dẫn dắt bởi một HLV nước ngoài. Gần nhất là nhà cầm quân người Bồ Đào Nha Flavio Costa Joreca, nhưng ông chỉ tại vị ba ngày từ 14/5/1944 đến 17/5/1944. Trong lúc tham gia sự kiện tại Brazil, Neymar nhận tin xấu khi căn biệt thự do anh đứng tên bị đình chỉ xây dựng do phạm luật bảo vệ môi trường. Công trình được xây ở thị trấn Mangaratiba, nằm ở bờ biển phía nam bang Rio de Janeiro (Brazil). Theo thông báo từ chính quyền địa phương, quá trình xây dựng đã sử dụng và di dời trái phép nguồn nước sạch, đá và cát. Nếu bị xác định có tội, Neymar sẽ phải nộp phạt ít nhất 1,05 triệu USD. Quan chức địa phương cho biết trong quá trình thanh tra khu xây dựng, cha của Neymar - ông Neymar da Silva Santos - đã lăng mạ họ. Phải đến khi bị cảnh sát đe dọa bắt giữ, ông mới ngừng hành động này. Người phát ngôn của gia đình Neymar cũng như tiền đạo thuộc biên chế PSG từ chối bình luận về vụ việc. Duy Đoàn (theo Globo)"
23,Thể thao,Ba bất ngờ ở vòng đầu Women’s PGA Championship 2023,"Giải diễn ra trên sân Baltusrol par71 ở New Jersey, quy tụ 156 đấu thủ tranh quỹ thưởng 10 triệu USD. Ngày mở màn 22/6, Lee Ann Pace, người Nam Phi đi từ hố 1, phát bình quân 257 yard, trúng 11 trong 14 fairway, lên green theo chuẩn 14 hố, gạt 29 cú. Với hiệu suất chuyên môn đó, Pace ghi năm birdie, cả vòng không bogey và nhờ vậy chiếm đỉnh bảng, ở mức -5. Đây là tín hiệu khả quan cho cô sau thời gian dài tham chiến với phong độ mờ nhạt ở đẳng cấp danh giá. Pace năm nay 42 tuổi, đã dự 39 giải major nhưng chỉ một lần vào top 10 chung cuộc – T6 Evian Championship 2015. Pace đấu chuyên nghiệp từ 2005, đến nay đã ẵm 11 cup trên Ladies European Tour hạng nhất châu Âu, nhưng mới được một chiếc ở LPGA Tour đồng đẳng gốc Mỹ. Trên bảng thứ bậc golf nữ chuyên nghiệp thế giới, Pace đứng thứ 193. Bốn năm qua, Pace không dự Women’s PGA Championship. Sau vòng một kỳ này, cô dẫn một gậy so với T2. Nhóm này lại có chuyện trùng hợp thú vị, khi cặp đồng hương Trung Quốc Xiyu Lin và Ruoning Yin cùng đạt -4. Lin 27 tuổi, còn Yin mới 20. Cả hai quen nhau đã gần bốn năm và xem nhau là chị em. Trong thời gian đó, Lin truyền kinh nghiệm để Yin tìm đường vào LPGA Tour. Và trong hành trình ấy, Yin thuê nhà cũ của Lin ở Orlando. Đầu tháng 4 năm nay, Yin đạt mốc đột phá trong sự nghiệp khi về nhất Los Angeles Open và trở thành nhà vô địch quốc tịch Trung Quốc thứ hai trong lịch sử LPGA Tour, sau Shanshan Feng. Yin lĩnh 262.500 USD từ thắng lợi đó. Sáng nay, Lin nói đùa trên Golf Channel rằng: ""Tôi đã định tăng giá thuê nhà sau khi Yin có chức vô địch ấy"". Với vị trí T2 (-4), Lin và Yin đang thuận lợi trong việc tranh cup hoặc được thu nhập đáng kể từ major do LPGA Tour đồng chủ trì với Hiệp hội Golf nhà nghề Mỹ. Trong ngân sách thưởng 10 triệu USD cho năm nay, phần vô địch chiếm 1,5 triệu USD, đánh trọn giải chắc chắn có phần, trong đó về chót nhận gần 19.500 USD. Tất cả đấu thủ không qua cắt loại sẽ được hỗ trợ 4.000 USD. Sau vòng 1, tân binh Celine Borge 24 tuổi cũng sáng cửa cạnh tranh khi đứng T6 (-2). Mùa chào sân LPGA Tour, Borge là trường hợp đặc biệt khi đã qua 10 giải mà không có caddie cố định và dày dạn kinh nghiệm theo thông lệ trong giới. Đây là sở thích của cô từ hồi còn đấu ở hệ thống hạng nhì Epson Tour. Vào Women’s PGA Championship tuần này, Borge hợp tác với trợ lý thực chiến thứ 11 kể từ khi thăng hạng – caddie Corey Birch đang trong biên chế sân Bartusrol với tần suất làm việc mỗi tuần 10 trận. Phần lớn vòng khai cuộc, Borge đã ""tự xử chuyên môn, từ chọn gậy đến gạt bóng, còn Birch hầu như chỉ vác ""bộ đồ nghề"". ""Tôi chỉ cần ai đó vác túi gậy và muốn thi đấu theo cách của mình"", Borge chia sẻ khi giới truyền thông thắc mắc về việc cô không có caddie ruột. Nhưng với cách này, Borge thể hiện ổn khi ghi ba birdie và một bogey trong cả trận đầu giải. Tổng kết chặng đầu Women’s PGA Championship, chỉ 16 đấu thủ đạt điểm âm, tính cả Borge. Trong 10 giải trước, cô qua cắt bảy lần trong đó ba lần vào top 20 chung cuộc. Quốc Huy"
