,Tag,Title,Content
7,Thể thao,Vì sao Arsenal vung tiền mua Havertz?,"Vừa là tiền đạo vừa là tiền vệ, Havertz hiếm khi tỏ ra hoàn toàn thoải mái với vai trò tại sân Stamford Bridge. Cầu thủ người Đức thi đấu qua ba đời HLV Chelsea, vận hành trong nhiều hệ thống, nhưng đến tận bây giờ, giới chuyên môn vẫn chưa xác định được đâu là vị trí tốt nhất của Havertz. Ngay cả HLV lừng danh Thomas Tuchel, thời còn dẫn dắt Chelsea, cũng không trả lời được câu hỏi này về học trò đồng hương, dù thừa nhận đây là cầu thủ độc đáo. Ông từng tự hỏi ""Havertz có cần ổn định ở một vị trí cụ thể không? Hay cậu ấy tiếp tục đá nhiều vị trí?"". Nhưng theo báo Anh Telegraph, với khoản phí chuyển nhượng 84 triệu USD, HLV Mikel Arteta rõ ràng có ý tưởng mạnh mẽ về cách khai thác tối đa tài năng của cầu thủ 24 tuổi. Trong đó, một phần quan trọng khiến Havertz hấp dẫn Arsenal là sự linh hoạt. Arteta và Giám đốc Thể thao Edu thường nhắm đến những cầu thủ có khả năng thi đấu ở nhiều vị trí và Havertz phù hợp với tiêu chí này. Nhưng chỉ sự linh hoạt không khiến một cầu thủ trị giá hơn 80 triệu USD. Đây không phải khoản phí mà Arsenal trả cho một cầu thủ chỉ đơn giản là giải pháp thay thế cho những ngôi sao tấn công không thể ra sân. Kỳ vọng vào cầu thủ người Đức lớn hơn nhiều việc giúp Arsenal có thể xoay tua đội hình và giảm tải cho các tiền đạo. Vậy Havertz còn mang đến cho Arsenal điều gì? Một trong những câu trả lời đơn giản hơn là chiều cao. Với chiều cao 1,9 m, cầu thủ người Đức cung cấp cho Arteta một khung thể chất khác trong các phương án tấn công, khi không có tiền đạo nào hiện tại của Arsenal cao hơn 1,8 m. Hơn nữa, không ai trong số họ đặc biệt lão luyện trong việc tận dụng các pha bóng bổng. Havertz không phải là mẫu tiền đạo tì đè, làm tường, nhưng có thể dứt điểm trên không ấn tượng, và biết cách tìm khoảng trống trong vòng cấm. Trong 32 bàn anh ghi cho Chelsea, có 10 bàn bằng đầu. ""Havertz rất thoải mái ở các vị trí dâng cao, và rất giỏi trong những pha đánh đầu. Cậu ấy hay có mặt đúng vị trí, đúng thời điểm trong vòng cấm, bình tĩnh, dứt điểm tốt"", Tuchel nói hồi 2021. Havertz thường sắm vai tiền đạo ở Chelsea, nhưng thứ bóng đá hay nhất của anh - như thời còn ở Leverkusen - đến từ một vị trí lùi sâu hơn. Một khi gia nhập Havertz đến Arsenal, để anh đá tiền vệ tấn công cùng Martin Odegaard sẽ là ý tưởng gây tò mò cho những người theo dõi tuyển thủ Đức lâu năm. Đương nhiên, có những yêu cầu phòng thủ trong vai trò đó có thể nằm ngoài bộ kỹ năng thông thường của Havertz. Nhưng nếu có thể di chuyển giữa hàng tiền vệ và hàng công khi Arsenal kiểm soát bóng, chọn thời điểm để khai thác khoảng trống phía sau lưng hàng thủ và xâm nhập vòng cấm, cầu thủ sinh năm 1999 sẽ mang đến những tình huống lên bóng linh hoạt và mưu mẹo khác cho lối chơi tấn công của ""Pháo thủ"". Theo Telegraph, Havertz có thể đá ""số 9 ảo"" thay Gabriel Jesus, hoặc chơi lùi sâu phía sau cầu thủ người Brazil. Sự có mặt của Havertz cũng sẽ cho phép Jesus dạt phải nhiều hơn, giảm bớt gánh nặng cho Bukayo Saka. Arsenal luôn vận hành rất tốt với những cầu thủ hoạt động ở giữa các tuyến, thay vì những vị trí cố định. Trong kỷ nguyên Ngoại hạng Anh, người thành công nhất trong số đó là huyền thoại Hà Lan Dennis Bergkamp. Tuchel từng so sánh Havertz với Bergkamp, và cả cựu tiền đạo Robin van Persie. Telegraph nhận định có những nghi ngờ nhất định về thể chất và tinh thần của Havertz. Đây là rủi ro lớn với Arsenal, với câu hỏi là cầu thủ người Đức có thể chịu được áp lực tâm lý khi chơi cho một trong những CLB lớn nhất ở châu Âu hay không. Havertz từng thừa nhận cảm thấy áp lực với mức phí 114 triệu USD mà Chelsea bỏ ra để tuyển mộ anh từ Leverkusen năm 2020. Anh cho biết sáu tháng đầu ở sân Stamford Bridge là khoảng thời gian thử thách nhất trong sự nghiệp. Havertz gia nhập CLB mới trong thời kỳ Covid-19 và phải gián đoạn thi đấu. Trong cuộc phỏng vấn với DAZN hồi đầu năm, cầu thủ 24 tuổi thừa nhận: ""Sự nhất quán luôn quan trọng trong sự nghiệp của tôi. Tôi thi thoảng đã đánh mất điều đó"". Bên cạnh những hạn chế vì Covid-19, Havertz cũng không thể thăng tiến bởi sự hỗn loạn tại Chelsea. Trong hai năm qua, CLB đã đổi chủ sở hữu, sử dụng nhiều HLV với những đội hình khác nhau, tuyển mộ hàng loạt tân binh và nhận những kết quả thảm hại. Ngay cả những tiền đạo trẻ tài năng nhất cũng không phát triển được trong bối cảnh như vậy. Hồi tháng 1/2023, Havertz đã lấy ví dụ về Jorginho để minh họa cho sự hỗn loạn của Chelsea ở mùa 2022-2023. ""Tôi đã chơi với Jorginho trong hai năm rưỡi và thích dành thời gian cùng anh ấy"", Havertz nói với Guardian. ""Và sau đó, Jorginho gọi cho tôi một buổi tối và nói đã rời CLB. Tôi như kiểu 'Cái quái gì vậy? Làm sao điều này có thể xảy ra được?' Đây là cách mà mọi thứ thay đổi nhanh chóng"". Jorginho, hiện với tư cách là cầu thủ Arsenal, hẳn đã nói chuyện với tiền đạo đàn em về việc chuyển tới sân Emirates. ""Những điều này không phải để bào chữa cho Havertz, người chắc chắn đã thi đấu kém hiệu quả trong phần lớn thời gian ở Chelsea, ngoại trừ bàn thắng trong trận chung kết Champions League 2021. Nhưng tình trạng hỗn loạn ở Stamford Bridge mang lại bối cảnh hữu ích. Arsenal tin rằng, trong tập thể ổn định hơn, tại CLB ít biến động, Havertz sẽ có thể phát huy hết tiềm năng to lớn"", Telegraph bình luận. Hồng Duy (theo Telegraph)"
8,Thể thao,HLV Hoàng Anh Tuấn: 'U17 Việt Nam đá trận hay nhất từ đầu giải',"""U17 Việt Nam đá trận hay nhất từ đầu giải"", HLV Hoàng Anh Tuấn nói ở họp báo sau trận vào tối 23/6. ""Thật tiếc kết quả không như mong đợi"". Điều tiếc nuối nhất của nhà cầm quân 55 tuổi là Việt Nam tạo ra nhiều cơ hội dứt điểm nhưng không thể tận dụng ghi bàn. Theo Sofascore, Việt Nam cầm bóng 46%, dứt điểm 11 cú, nhưng chỉ một đi trúng đích, trong khi Uzbekistan chỉ trúng đích ở ba trong 12 cú dứt điểm. Việt Nam lép vế trong hiệp một và thủng lưới ở phút 24, nhưng chơi tốt ở hiệp hai. Hoàng Công Hậu, Lê Huỳnh Triệu hay Lê Đình Long Vũ đều có cơ hội tốt để ghi bàn trong 20 phút cuối, nhưng đều kết thúc thiếu chính xác. HLV Hoàng Anh Tuấn thừa nhận cầu thủ nhập cuộc không tốt, đồng thời không giải tỏa được tâm lý căng thẳng ở cả ba trận. Trừ trận thua toàn diện Nhật Bản, hai trận còn lại đều để lại những tiếc nuối. ""Toàn đội chưa thể hiện được những gì mà ban huấn luyện chuẩn bị"", HLV người Khánh Hòa nói. ""Dù sao họ còn rất trẻ, và đây là những trải nghiệm quý báu"". Trước khi thua Uzbekistan, Việt Nam lần lượt hòa Ấn Độ 1-1 và thua Nhật Bản 0-4. Chung cuộc, đội xếp cuối bảng D với 1 điểm và hiệu số -5, bằng Ấn Độ nhưng kém số bàn thắng (1 so với 5). Trong khi đó, Nhật Bản và Uzbekistan dắt tay nhau vào tứ kết. Bốn cặp tứ kết được xác định lần lượt là chủ nhà Thái Lan - Hàn Quốc, Iran - Yemen, Arab Saudi - Uzbekistan và Nhật Bản - Australia. Bốn đội chiến thắng sẽ giành vé dự FIFA U17 World Cup 2023 tổ chức từ ngày 10/11 đến 2/12 tại Indonesia - chủ nhà mới thay thế Peru. Hiếu Lương"
9,Thể thao,Mỹ đăng cai FIFA Club World Cup 2025,"Theo thông báo của FIFA ngày 23/6, giải đấu kéo dài ba tuần ở Mỹ, trong khoảng tháng 6-7/2025, tại các sân vận động chuẩn bị cho World Cup 2026 - sự kiện do Mỹ, Canada và Mexico đồng đăng cai. Thể thức của FIFA Club World Cup 2025 chưa được quyết định nhưng nhiều khả năng 32 đội sẽ chia tám bảng nhằm đảm bảo mỗi CLB chơi ít nhất ba trận. Tổng cộng giải có thể có 56 trận, gồm cả trận tranh hạng Ba. Phiên bản FIFA Club World Cup hiện tại gồm bảy đội sẽ diễn ra lần cuối vào năm nay, từ 12-22/12 tại Saudi Arabia. Theo FIFA, phiên bản 32 đội hứa hẹn hấp dẫn hơn, diễn ra bốn năm một lần thay vì thường niên. Trong 32 CLB góp mặt, châu Âu có 12 suất và Nam Mỹ có sáu suất. Trong 12 CLB châu Âu có bốn nhà vô địch Champions League ở bốn mùa gần nhất. Điều này đồng nghĩa Real, Man City và Chelsea đã chắc suất tham dự. Đội đăng quảng Champions League 2023-24 sẽ lấy suất thứ tư. Tám suất còn lại của châu Âu dựa vào thứ bậc bảng điểm UEFA trong bốn năm. Ở những khu vực khác, AFC (châu Á), CAF (châu Phi) và CONCACAF (Bắc Trung Mỹ & Carribe) mỗi khu vực có bốn đại diện. OFC (châu Đại Dương) và Liên đoàn chủ nhà mỗi bên có một CLB tham dự. Do chủ nhà Mỹ nằm thuộc CONCACAF, khu vực này sẽ có năm CLB tranh tài. Với quyết định của FIFA, Mỹ sẽ đăng cai ba giải lớn trong ba năm liên tiếp, trước mắt là Copa America 2024. ""Chúng tôi tin Mỹ là địa điểm tổ chức lý tưởng bởi cơ sở vật chất và kinh nghiệm của họ"", Chủ tịch FIFA Infantino nói trong cuộc họp trực tuyến ngày 23/6. ""FIFA Club World Cup 2025 sẽ là đỉnh cao của bóng đá cấp CLB"". Cùng với việc ra mắt phiên bản mới, sự kiện cũng là nơi để FIFA thử nghiệm các mô hình bản quyền truyền hình mới, kiếm thêm các nhà tài trợ và dự kiến mang về doanh thu hàng trăm triệu USD cho 32 CLB góp mặt. Vy Anh"
10,Thể thao,Chelsea xác nhận mua Vua phá lưới Bundesliga,"""Nkunku mặc áo xanh"", Chelsea chú thích video đăng trên Twitter. Không lâu sau đó, đội bóng Anh đăng ảnh kèm dòng chữ: ""Chào mừng Nkunku"". Theo tờ Daily Mail, Chelsea đã đạt thỏa thuận cá nhân với Nkunku từ tháng 12/2022. Đội bóng Anh cũng chấp nhận chi 67 triệu USD để kích hoạt điều khoản phá vỡ hợp đồng giữa tiền đạo người Pháp và RB Leipzig. Nkunku hài lòng khi được khoác áo Chelsea. Tiền đạo 25 tuổi háo hức gặp HLV, đồng đội và chinh phục CĐV mới. ""Tôi từng chơi tại Ligue 1 và Bundesliga"", Nkunku cho biết. ""Bây giờ, tôi muốn chơi ở Ngoại hạng Anh. Đó là một trong những giải vô địch quốc gia mạnh nhất thế giới. Tôi rất hào hứng với thử thách này và tự hào khi được khoác áo Chelsea"". Theo hai đồng Giám đốc Thể thao Laurence Stewart và Paul Winstanley, Nkunku là một trong những tiền đạo hay nhất hai mùa vừa qua. Trung phong giá 67 triệu USD sẽ bổ sung chất lượng, sự sáng tạo và tính linh hoạt cho hàng công Chelsea. Mùa 2022-2023, Nkunku kết thúc Bundesliga với 16 bàn và sáu pha kiến tạo. Tiền đạo 25 tuổi phải dưỡng thương một thời gian dài, nhưng vẫn kịp giành giải đồng Vua phá lưới với Niclas Fullkrug. Nkunku cũng giúp RB Leipzig hạ Frankfurt 2-0 trong trận chung kết Cup Đức. Mùa trước đó, Nkunku chơi tốt hơn. Anh góp 20 bàn và 15 kiến tạo tại Bundesliga, nâng tổng thành tích trên mọi đấu trường lên 35 bàn và 20 kiến tạo. Nkunku qua mặt Robert Lewandowski để giành giải Cầu thủ hay nhất Bundesliga 2021-2022. Nkunku lỡ hẹn với World Cup 2022 do chấn thương. Bảy ngày trước trận mở màn của tuyển Pháp, anh va chạm với Edouardo Camavinga và đau đầu gối. HLV Didier Deschamps phải thay Nkunku bằng Kolo Muani. Nhưng chính Muani bỏ lỡ cơ hội vàng ở phút bù giờ trận chung kết. Mùa vừa qua, Chelsea chỉ ghi 38 bàn qua 38 trận và là một trong sáu đội ghi bàn kém nhất Ngoại hạng Anh. Họ vì thế kết thúc Ngoại hạng Anh 2022-2023 với vị trí 12. Mùa tới, Nkunku và đồng đội sẽ không được dự Cup châu Âu. Nkunku là tân binh đầu tiên của Chelsea hè này. Ở chiều ngược lại, CLB đã giải phóng Tiemoue Bakayoko và N'Golo Kante. Họ cũng đạt thỏa thuận bán Mateo Kovacic cho Man City và Kai Havertz cho Arsenal. Thanh Quý (theo Daily Mail, Twitter)"
11,Thể thao,Việt Nam dừng bước ở vòng bảng U17 châu Á 2023,"* Ghi bàn: Shodiboev 24’ Việt Nam thua 0-1, còn ở trận cùng giờ Nhật Bản đánh bại Ấn Độ 8-4. Bảng D khép lại với vị trí thứ nhất thuộc về Nhật Bản - đội có cùng bảy điểm, nhưng đứng trên Uzbekistan về hiệu số bàn thắng bại (+7 so với +2). Thầy trò ông Hoàng Anh Tuấn bước vào trận đấu tại sân Thammasat tối 23/6 với tâm thế buộc phải thắng. Tuy nhiên, Uzbekistan được đánh giá mạnh, hơn nên Việt Nam vẫn chơi cẩn trọng theo sơ đồ 5-4-1. Dù phòng ngự lùi sâu chờ phản công, khung thành Việt Nam luôn trong tình trạng nguy hiểm vì Uzbekistan tấn công biên tốt. Phút 22, Ollobergan Karimov nhả bóng ra tuyến hai để Ozodbek Uktamov sút xa từ khoảng 22 mét, khiến thủ môn Bảo Ngọc vất vả cản phá. Hai phút sau, Karimov hút theo hai cầu thủ Việt Nam trước khi nhả bóng để Lizizbek Mirzayev băng xuống ở biên phải rồi căng ngang vào vòng cấm. Trong thế không người kèm, Shodiyor Shodiboev đá nối đưa bóng chạm mép xà ngang trước khi vào lưới. Bàn thua khiến Việt Nam phải đẩy đội hình lên tấn công mở ra nhiều cơ hội cho Uzbekistan phản công. Nhưng lần lượt Mirzayev và Shodiboev bỏ lỡ khi đối mặt thủ môn Bảo Ngọc. Mãi đến phút 41, Việt Nam mới có cú sút đầu tiên từ ngoài vòng cấm từ nỗ lực cá nhân của Lê Huỳnh Triệu. Sang hiệp hai, HLV Hoàng Anh Tuấn tung thêm tiền đạo Hoàng Công Hậu vào sân để tăng sức tấn công. Hàng thủ Việt Nam cũng chơi tốt lên, chống phản công hiệu quả, giúp hàng công thoải mái hơn. Phút 70, Lê Đình Long Vũ qua người bên cánh trái rồi dứt điểm vào góc gần nhưng hậu vệ Uzbekistan cản phá trước vạch vôi. Năm phút sau, Công Hậu thoát xuống đón đường chọc khe nhưng sút không trúng tâm bóng. Không lâu sau đó, Việt Nam gây áp lực rồi cướp bóng bên sân đối phương, Công Hậu chuyền cho Huỳnh Triệu bên cánh trái trống trải, nhưng cú sút cuối lại đi vọt xà. Việt Nam tiếp tục tung thêm cầu thủ cao hơn 1m90 Đinh Quang Kiệt vốn đá trung vệ vào làm tiền đạo, tận dụng bóng bổng nhưng không tạo hiệu quả. Đội không thể ngược dòng dù hiệp hai có thêm bảy phút bù. Thất bại này khiến HLV Hoàng Anh Tuấn cùng Việt Nam lần thứ hai liên tiếp dừng chân ở vòng bảng giải châu lục trong năm 2023, sau giải U20 châu Á. Đội hình xuất phát: U17 Việt Nam: Bảo Ngọc, Đặng Thanh Bình, Nguyễn Lương Tuấn Khải, Phan Văn Thành, Quốc Khánh, Thiên Phú, Phạm Nguyễn Quốc Trung, Lê Đình Long Vũ, Lê Huỳnh Triệu, Công Phương, Vi Đình Thượng U17 Uzbekistan: Muhammadyusuf Sobirov, Bekhruz Jumatov, Ollobergan Karimov, Shodiyor Shodiboev, Ozodbek Uktamov, Azizbek Tulkunbekov, Mukhammedali Reimov, Behruz Shukurullaev, Sherzodbek Abdulboriev, Dilshod Abdullayev, Lazizbek Mirzayev. Hiếu Lương"
12,Thể thao,Việt Nam vào bán kết giải bóng chuyền nữ AVC Challenge Cup 2023,"Việt Nam chạm trán Đài Loan ở lượt trận cuối vòng bảng vào chiều nay 23/6 tại nhà thi đấu Tri Dharma Petrokimia Gresik, Indonesia. Hàng chắn Việt Nam chơi tốt khi đem về 13 điểm, trong khi hàng sau luân chuyển bóng và phòng thủ tốt giúp đội chỉ mắc tám lỗi cả trận. Đội trưởng Trần Thị Thanh Thuý tiếp tục là điểm sáng khi ghi 22 điểm, góp phần giúp Việt Nam thắng dễ sau ba set với tỷ số 25-20, 25-17 và 25-19. Việt Nam trải qua chuỗi bốn trận bất bại tại giải mà không thua set nào. Trước đó, đội lần lượt thắng 3-0 Mông Cổ và Uzbekistan ở vòng loại. Đến vòng bảng, Việt Nam thắng áp đảo Iran 25-10, 25-9 và 25-18 trước khi hạ Đài Loan hôm nay. Thành tích toàn thắng giúp Việt Nam đứng nhất bảng F, xếp sau là Đài Loan. Vị trí này giúp thầy trò HLV Nguyễn Tuấn Kiệt khả năng cao tránh được Indonesia - đối thủ mạnh đồng thời là chủ nhà - thay vào đó gặp Ấn Độ hoặc Philippines ở bán kết vào ngày mai 24/6. AVC Challenge Cup được Liên đoàn bóng chuyền châu Á (AVC) thành lập năm 2018, tổ chức hai năm một lần dành cho các đội tuyển nữ quốc gia cấp thấp, xếp sau Giải bóng chuyền vô địch châu Á và Cup bóng chuyền châu Á. Hai kỳ đầu tiên diễn ra tại Hong Kong nhưng phải huỷ vì dịch bệnh và lý do bất khả kháng. Năm 2022, giải lần đầu diễn ra tại Thái Lan với đội vô địch là Hong Kong. Đội vô địch AVC Challenge Cup 2023 sẽ có suất dự FIVB Challenge Cup 2023 của Liên đoàn bóng chuyền thế giới. Trước giải này, Việt Nam giành HC bạc SEA Games 32 sau khi thua Thái Lan. Đội vô địch giải bóng chuyền các CLB châu Á 2023 khi ngược dòng thắng Diamond Food Fine Chef 3-2, qua đó giành vé dự giải bóng chuyền các CLB thế giới vào cuối năm. Hiếu Lương"
13,Thể thao,Cầu thủ nào hai lần liền phá kỷ lục chuyển nhượng?,Xuân Bình
14,Thể thao,Các đội tốn gần 9 triệu USD phí chuyển nhượng cho Chanathip,"BG Pathum United chấp nhận mức giá mà Kawasaki Frontale đưa ra, khi hợp đồng của CLB Nhật Bản với Chanathip còn thời hạn tới ngày 31/1/2025. Chấn thương khiến tiền vệ 29 tuổi đóng góp hạn chế sau hai mùa, khi chỉ thi đấu 27 trận và ghi ba bàn nên quyết định trở lại Thái Lan. BG Pathum United chi mạnh tay để lấy lại vị thế sau khi chỉ xếp thứ chín trong 16 đội Thai League 1 mùa 2022-2023. Trước đó, đội từng vô địch mùa 2020-2021 và á quân 2021-2022. Tại đây, Chanathip sẽ được thi đấu với những đồng đội quen thuộc trên đội tuyển Thái Lan như tiền đạo Teerasil Dangda, tiền vệ Sarach Yooyen hay Phitiwat Sukjitthammakul. Chanathip đến BG Pathum United là thương vụ đắt thứ hai trong lịch sử Thai League, sau khi Port FC chi 2,8 triệu USD để mua tiền đạo Dragan Boskovic từ Bangkok United mùa 2017-2018. Tháng 1/2022, Kawasaki Frontale, khi ấy là đương kim vô địch J-League 1, mua Chanathip với giá 3,8 triệu USD – kỷ lục chuyển nhượng cầu thủ giữa các CLB Nhật Bản lúc đó. Tính cả thương vụ đến BG Pathum United, Chanathip khiến các đội phải chi ra 8,8 triệu USD (khoảng 207 tỷ đồng) trên thị trường chuyển nhượng. Theo Siam Sport, Chanathip đang là cầu thủ có tổng phí chuyển nhượng cao nhất lịch sử bóng đá Thái Lan. Tiền vệ sinh năm 1993 bỏ xa người xếp thứ hai là Tanaboon Kerasat, người trải qua ba vụ chuyển nhượng với tổng giá trị 3,2 triệu USD lần lượt từ Muangthong United đến Chiangrai United rồi BG Pathum United và hiện tại là Port FC. Theo trang web Đức chuyên định giá trị cầu thủ Transfermakt, giá chuyển nhượng của Chanathip hiện ở mức 1,3 triệu USD. Anh từng đạt giá trị cao nhất vào tháng 12/2019, với 2,6 triệu USD. Chanathip sẽ tròn 30 tuổi vào ngày 5/10/2023. Anh có chiều cao khiêm tốn 1,63 m nhưng bù lại bằng kỹ thuật điêu luyện, nhãn quan bóng đá sắc sảo. Cầu thủ có biệt danh ""Messi Thái"" này được xem là tiền vệ tấn công hay bậc nhất lịch sử bóng đá Thái Lan. Chanathip khởi nghiệp ở BEC Tero Sansana năm 2012 trước khi chuyển sang Muangthong United từ 2016. Anh đá 120 trận và ghi 14 bàn tại Thai League 1. Dấu ấn lớn nhất của Chanathip là vô địch Thai League 1 và cùng Muangthong United vào tứ kết AFC Champions League năm 2016. Trong bảy năm ở Nhật Bản, Chanathip thi đấu 144 trận, ghi 15 và kiến tạo 22 bàn. Tiền vệ 29 tuổi không đạt thành tích tập thể, nhưng được vinh danh vào đội hình tiêu biểu J-League 1 và nhận giải Cầu thủ hay nhất Consadole Sapporo năm 2018. Ở cấp đội tuyển, Chanathip sở hữu trọn bộ danh hiệu cấp Đông Nam Á từ vô địch AFF U19 năm 2011, giành HC vàng SEA Games 2013 và 2015, ba lần vô địch AFF Cup 2014, 2016 và 2020. Trung Thu"
15,Thể thao,Truyền thông Pháp: 'PSG đồng ý bán Mbappe cho Real',"Theo đó, một cuộc gặp giữa đại diện ban lãnh đạo PSG và Real đã được tổ chức hôm 21/6. Tiểu vương Qatar Tamim bin Hamad Al Than, người sở hữu PSG, và Chủ tịch Real Florentino Perez sau đó trao đổi qua lại bằng tin nhắn, và đạt thỏa thuận về trường hợp của Mbappe. PSG Community khẳng định, Real chấp nhận trả ngay cho PSG khoảng 215 triệu USD, kèm theo 55 triệu USD phụ phí tùy vào số trận Mbappe thi đấu cho Real và việc anh có giành Quả Bóng Vàng hay không. Nếu thành hiện thực, Real sẽ phá kỷ lục chuyển nhượng của bóng đá thế giới hiện tại thuộc về Neymar. Tiền đạo người Brazil được PSG mua về năm 2017, với giá 263 triệu USD từ Barca. Mbappe thi đấu cho PSG cũng từ 2017, theo diện cho mượn từ Monaco. Một năm sau, đội chủ sân Parc des Prices kích hoạt điều khoản mua đứt, biến anh thành cầu thủ tuổi teen đắt giá nhất trong lịch sử với giá 159 triệu USD, cộng thêm 38,3 triệu USD phụ phí trong vòng một năm sau đó. Mbappe chỉ còn một năm hợp đồng với PSG. Ngày 12/6, tiền đạo 24 tuổi tuyên bố sẽ không gia hạn, đồng nghĩa anh có thể tự do ra đi vào hè năm sau. Trước nguy cơ mất trắng ngôi sao số một, PSG ra tối hậu thư cho Mbappe, buộc tiền đạo này phải gia hạn hoặc ra đi ngay hè này. Mbappe từng suýt chuyển đến Real vào hè 2022, nhưng đổi ý, gia hạn vì những hứa hẹn từ PSG. Tuy nhiên, tuyển thủ Pháp được cho là thất vọng với kế hoạch phát triển của CLB Pháp và muốn dứt áo ra đi. Mbappe nhiều lần bày tỏ Real là đội bóng anh mơ ước khoác áo. Việc tiền đạo Karim Benzema rời sân Bernabeu càng làm khả năng này tăng lên. Duy Đoàn (theo PSG Community)"
