,Tag,Title,Content
34,Thể thao,Những dấu hỏi về kế hoạch chuyển nhượng của Arab Saudi,"Trong năm 2023, hai cầu thủ từng giành Quả Bóng Vàng - Cristiano Ronaldo và Karim Benzema - đều tới thi đấu tại Arab Saudi với thu nhập kỷ lục 200 triệu USD. Cựu vô địch World Cup và Champions League của Chelsea, N'Golo Kante cũng vừa ra mắt tại Al-Ittihad ngày 21/6, với thua nhập mùa là 100 triệu USD. Nhưng đó chỉ là màn dạo đầu, khi nhiều cầu thủ Chelsea như Edouard Mendy, Kalidou Koulibaly, Hakim Ziyech... cũng chuẩn bị hoàn tất việc tới Saudi Pro League. Những tên tuổi lớn khác như Sergio Ramos, Bernardo Silva và Son Heung-min đang nhận được những đề nghị hậu hĩnh từ quốc gia Arab. Tại sao bóng đá Arab Saudi lại đột ngột chi số tiền lớn cho các cầu thủ nước ngoài như bây giờ? Theo Sky Sports (Anh), đầu tiên, Arab Saudi đang tìm cách mở rộng nền kinh tế thông qua các ngành công nghiệp khác để giúp đảm bảo tương lai tài chính. Quốc gia này vốn phụ thuộc vào việc bán dầu mỏ - điều sẽ không tồn tại mãi mãi, và họ cần phải đa dạng hóa nền kinh tế. Và Arab Saudi làm điều này thông qua PIF - Quỹ đầu tư công của đất nước. Thể thao là một lĩnh vực cụ thể mà Arab Saudi đang muốn phát triển trong nước, gồm Saudi Pro League. Quốc gia Trung Đông này muốn xây dựng ngành công nghiệp giải trí của riêng họ, và khai thác lượng lớn sự quan tâm của người dân Arab Saudi, trong đó 70% là dưới 40 tuổi, với bóng đá. Bóng đá là môn thể thao đại chúng ở Arab Saudi, và họ là đội tuyển được hỗ trợ tốt nhất tại World Cup 2022. Ở giải đấu này, Arab Saudi gây tiếng vang khi đánh bại Argentina - đội sau đó lên ngôi vô địch - ở trận mở màn, và xem đây là cách để tăng lượng khách du lịch. Các nhà chức trách của Arab Saudi đã nhìn thấy tất cả mối quan tâm này và nghĩ: Thay vì để người khác kiếm tiền từ sở thích thể thao của người dân Arab Saudi, chúng ta hãy tự mình kiếm tiền và giữ tiền trong biên giới đất nước. Họ muốn đưa bóng đá Arab Saudi lên bản đồ thế giới và nâng cao vị thế. Arab Saudi còn hy vọng đạt được điều gì? Tổ chức Ân xá Quốc tế đã cáo buộc Arab Saudi ""dùng thể thao để khỏa lấp tiếng xấu về nhân quyền cực"". Tổ chức Theo dõi Nhân quyền thì cho rằng Arab Saudi chi hàng tỷ USD để tổ chức các sự kiện giải trí, văn hóa và thể thao lớn nhằm làm chệch hướng chú ý khỏi vấn đề nhân quyền tồi tệ của đất nước. Báo cáo năm 2022 của Tổ chức Theo dõi Nhân quyền kết luận rằng Arab Saudi đã công bố một số cải cách, nhưng sự đàn áp liên tục và sự coi thường các quyền cơ bản vẫn là những rào cản lớn với sự tiến bộ. Một cuộc điều tra của Liên Hợp Quốc về vụ sát hại nhà báo Jamal Khashoggi năm 2018 cho biết cái chết của ông ""cấu thành một vụ giết người phi pháp mà Arab Saudi phải chịu trách nhiệm"". Ngoài việc được sử dụng để tẩy rửa tiếng xấu nhân quyền, đầu tư vào bóng đá còn có thể mua được ảnh hưởng và uy tín trên toàn thế giới và thể hiện quyền lực mềm. Saudi Arabia được cho là sẽ chạy đua đăng cai World Cup 2030 cùng với Hy Lạp và Ai Cập. Đây có phải mục tiêu dài hạn của Arab Saudi? Những gì đang diễn ra tại Saudi Pro League gợi lại sự ra đời của Chinese Super League ở Trung Quốc vào năm 2004, khi đột nhiên các ngôi sao như Oscar và Marko Arnautovic chuyển đến châu Á. Đây là mệnh lệnh trực tiếp từ Chủ tịch nước này Tập Cận Bình, khi ông muốn Trung Quốc đăng cai World Cup, có một đội tuyển quốc gia tốt và một giải vô địch quốc gia mạnh. Nhưng sau đó, Trung Quốc thay đổi, không thích cảnh luồng tiền khổng lồ từ trong nước chảy vào túi các CLB châu Âu. Họ quyết định chấm dứt điều này, và đặt ra vô số quy tắc để kiểm soát số lượng cầu thủ nước ngoài được thi đấu tại Chinese Super League. Theo Sky Sports, Saudi Arabia cũng đang đặt mục tiêu dài hạn, nhưng quốc gia này có nhiều tiền hơn và tạo cảm giác làm việc nghiêm túc hơn. Đây là sự khởi đầu của một quá trình và không phải là thứ sẽ biến mất nhanh chóng. Cũng theo hãng tin Anh, trong năm năm tới, Arab Saudi muốn có 100 cầu thủ nước ngoài giỏi nhất thi đấu tại Saudi Pro League. Ronaldo là người đầu tiên, và họ đã đề nghị mức lương mùa kỷ lục 400 triệu USD với Lionel Messi. Nhưng ngôi sao Argentina từ chối để chuyển đến MLS. Điều này không ngăn cản tham vọng của Arab Saudi, khi Ruben Neves sắp gia nhập Al Hilal, và ba cầu thủ Chelsea, gồm Kalidou Koulibaly, Hakim Ziyech và Edouard Mendy, chuẩn bị hoàn tất việc tới Arab Saudi. Trong tương lai, những Harry Kane, hay thậm chí Erling Haaland, Kylian Mbappe cũng có thể vào tầm ngắm trong tham vọng của các nhà làm bóng đá Arab Saudi. Mohammed Hamdi, một chuyên gia về bóng đá ở Trung Đông và là cựu giám đốc của Al Jazira FC ở Abu Dhabi, nói với Sky Sports News rằng ông tin Arab Saudi sẽ không gặp vấn đề gì trong việc thu hút những tài năng hàng đầu. ""Họ có cơ sở hạ tầng"", ông nói. ""Họ có đất nước hậu thuẫn, có thể tổ chức một kỳ World Cup. Chúng ta đã thấy World Cup ở Qatar tuyệt vời thế nào. Đây là tầm nhìn dài hạn, nơi bạn có thể thu hút các hợp đồng truyền hình, phương tiện truyền thông, tài trợ và nhiều du khách hơn đến đất nước. Không chỉ các cầu thủ lớn tuổi, bạn có thể sẽ thấy những cầu thủ trẻ sẵn sàng thi đấu tại Saudi Pro League"". Saudi Arabia đã bóp méo thị trường chuyển nhượng? Hè này, gần như thương vụ chuyển nhượng nào cũng có những tin đồn liên quan đến các CLB Arab Saudi, ngay cả những tên tuổi tưởng ""bất khả xâm phạm"" như Son Heung-min ở Tottenham. Arab Saudi có đủ tiền để ký hợp đồng với bất kỳ cầu thủ nào họ muốn, miễn là anh này muốn rời đi. Ruben Neves là ví dụ rõ ràng nhất. Tiền vệ Bồ Đào Nha mới 26 tuổi, đang ở đỉnh cao sự nghiệp, được Liverpool, Barca, Man Utd quan tâm, nhưng quyết định gia nhập Al Hilal với mức lương cao gấp 10 lần so với thu nhập ở Wolves. ""Vì vậy, thị trường chuyển nhượng đã thay đổi đáng kể, khi các CLB có sự cạnh tranh nghiêm trọng từ Arab Saudi - một thị trường rất béo bở đã mở ra"", Sky Sports bình luận. Chelsea có lách luật Công bằng tài chính (FFP) nhờ Arab Saudi? Chelsea đang chịu áp lực phải thu hồi vốn thông qua việc bán cầu thủ vào cuối tháng này sau khi chi 668 triệu USD cho hai kỳ chuyển nhượng mùa 2022-2023, trong năm đầu tiên thuộc quyền sở hữu của Todd Boehly và Clearlake Capital. Những thương vụ bán của Chelsea được hoàn tất trước ngày 30/6 sẽ được tính vào năm tính thuế đầy đủ đầu tiên, và do đó giúp giảm thiểu tổn thất để hỗ trợ việc tuân thủ FFP. PIF - đơn vị sở hữu bốn câu CLB Arab Saudi - đang tìm cách mua các cầu thủ Chelsea, đã đầu tư vào Clearlake Capital - quỹ đầu tư tư nhân là cổ đông chính của Chelsea. Ngoài ra, chủ tịch Chelsea Boehly đã được phát hiện gặp gặp chủ tịch Al Hilal Fahd bin Nafel tại Arab Saudi hồi đầu tháng. Tại cuộc họp còn có Hoàng tử tỷ phú Arab Saudi Saudi Al-Waleed bin Talal - một CĐV của Al Hilal, người đã bán cổ phần thiểu số trong công ty đầu tư của ông cho PIF vào năm ngoái. Nhưng theo Sky Sports, việc các CLB Arab Saudi muốn mua cầu thủ Chelsea không liên quan đến việc CLB này cần thu hồi vốn để ""xoa dịu"" các yêu cầu của FFP. PIF đầu tư vào rất nhiều quỹ đầu tư tư nhân trên toàn thế giới, và Clearlake đã đầu tư vào 400 công ty khác nhau. Phía Chelsea cũng khẳng định hoàn toàn không có xung đột lợi ích trong đó. Hồng Duy (theo Sky Sports)"
35,Thể thao,Federer: 'Djokovic có thể đã là GOAT',"Federer vừa trở lại giải Halle Mở rộng, nơi anh vô địch 10 lần. Tay vợt Thụy Sĩ được ban tổ chức giới thiệu trên sân kèm nền bài hát Simply The Best, rồi trả lời hàng loạt câu hỏi về quần vợt. Khi được hỏi về vị thế GOAT (Vĩ đại nhất mọi thời) trong làng banh nỉ, Federer không nhắc tên bản thân. Anh nói: ""Djokovic đã có 23 Grand Slam và có thể là đủ để thành GOAT. Nhưng một khi Nadal còn thi đấu thì điều đó chưa kết luận được"". Djokovic độc chiếm kỷ lục 23 Grand Slam sau khi vô địch Roland Garros hôm 11/6. Tay vợt Serbia nhiều hơn Rafael Nadal một danh hiệu, trong bối cảnh ""Vua đất nện"" sẽ nghỉ đến cuối mùa vì chấn thương và có thể giải nghệ vào 2024. Federer cũng cho biết không thể so sánh việc Djokovic đoạt Roland Garros ở tuổi 36 với việc Boris Becker đoạt Wimbledon năm 17 tuổi. Bản thân Federer từng đoạt Australia Mở rộng ở tuổi 37 vào năm 2018. ""Tôi không còn nhớ quần vợt"", Federer nói về trải nghiệm gần một năm sau khi giải nghệ. ""Tôi chăm sóc gia đình theo cách khác vì bây giờ có rất nhiều thời gian. Tôi đi trượt tuyết với bọn trẻ, làm việc nhà. Khoảng ba, bốn ngày tôi mới kiểm tra kết quả các giải quần vợt"". Bên cạnh gia đình, Federer bận rộn với các dự án kinh doanh, từ thiện. Anh vừa trở về từ Nam Phi sau chuyến từ thiện xây dựng trường học cho trẻ em. Huyền thoại 41 tuổi tiết lộ chấn thương đầu gối vẫn chưa bình phục khiến anh không thể chơi các trận biểu diễn dù nhận nhiều lời mời. ""Tôi vẫn tập thể lực bốn, năm lần mỗi tuần"", Federer nói thêm. ""Nếu cơ thể cho phép, tôi muốn chơi vài trận biểu diễn. Tôi chưa sẵn sàng làm bình luận viên hay gì đó tương tự. Có thể tôi sẽ không bao giờ làm công việc đó"". Vy Anh"
36,Thể thao,Truyền thông Syria bất đồng sau trận thua Việt Nam,"Trang SnackSyrian nhận xét trận đấu giữa Việt Nam và Syria khá nhạt nhòa, và hai đội tuyển đều khan hiếm cơ hội thực sự nguy hiểm. ""Tuy nhiên, Syria cho thấy sự tiến bộ ở khả năng kiểm soát và luân chuyển bóng giữa các cầu thủ"", bài báo có đoạn. ""Đó là dấu hiệu cho thấy ảnh hưởng của HLV Hector Cuper lên đội tuyển. Ông vẫn còn thời gian dài để cống hiến, và không nên đánh giá ông chỉ qua vài trận giao hữu"". Tờ Athr Press cũng đồng tình với quan điểm này khi họ kêu gọi Syria cho HLV Cuper thêm thời gian, dù đội ""không gây ấn tượng nào"" ở trận gặp Việt Nam. ""Sau bàn thua, chúng tôi kỳ vọng Syria thay đổi để chơi tốt hơn, nhưng chủ nhà vẫn chiếm lĩnh thế trận"", tác giả Mohsin Imran viết thêm. ""Cuper chưa đem lại điều gì khởi sắc nhưng vẫn còn quá sớm để đánh giá ông"". Giai đoạn 2022-2023, Syria trải qua sáu trận toàn thua dưới trướng HLV Hussam Al Sayed, khiến ông bị sa thải. Cuper được bổ nhiệm thay thế Al Sayed từ tháng 2/2023, và ông giúp Syria thắng trận đầu tay với tỷ số 3-1 trước Thái Lan. Nhưng trong hai trận qua, thầy trò Cuper đều thất bại, gần nhất là kết quả 0-1 trước Việt Nam trên sân Thiên Trường. Sau trận, HLV người Argentina cho rằng cầu thủ Syria vẫn chưa quen thời tiết nóng ẩm tại Việt Nam dù đã tập luyện ở đây hơn một tuần. Do Syria đã thua tám trong chín trận gần đây, người hâm mộ và truyền thông nước này thất vọng với màn thể hiện của đội nhà. Trong khi SnackSyrian kêu gọi LĐBĐ Syria kiên nhẫn với Cuper, tờ Al Baath chê trách cầu thủ. ""Chẳng có gì mới với Syria"", báo này viết. ""Chúng ta thua Việt Nam không phải vì điều kiện thời tiết, mà bởi hàng thủ yếu kém và hàng công vô dụng. Syria hiếm khi gây nguy hiểm cho chủ nhà, còn các cầu thủ không thể tìm cách tạo ra cơ hội"". Al Baath còn cho rằng vấn đề của Syria đã thuộc về hệ thống phòng ngự của bóng đá nước này, vì đội U23 Syria cũng gặp khó khăn tương tự với hai trận thua liên tiếp. Nhiều người lên tiếng kêu gọi sa thải vài quan chức của LĐBĐ Syria, HLV Cuper hay loại bỏ những cầu thủ không còn nhiệt huyết trên tuyển. ""Có thay đổi thế nào cũng không cải thiện được tình hình, nếu không tìm ra gốc rễ của vấn đề"", tờ báo viết thêm. ""Chúng ta cần bình tĩnh nghiên cứu kỹ lưỡng mọi vấn đề, không nên quyết định nóng vội vào lúc này"". Báo Thawra cũng không bất ngờ với thất bại của Syria, và họ hướng chỉ trích vào LĐBĐ, vì không có ai đứng ra nhận trách nhiệm hay giải trình về thực trạng của đội. Các hệ đội tuyển Syria từ U17 đến đội trưởng thành đều trải qua chuỗi trận bết bát. Trái ngược tình hình của Syria, Việt Nam đang trải qua chuỗi 10 trận bất bại trên sân nhà ở mọi đấu trường, trong đó có chín chiến thắng. Đội cũng bất bại 22 trận giao hữu gần nhất. Thầy trò Philippe Troussier sẽ hội quân trở lại vào tháng 9/2023, dự kiến đá giao hữu hai trận nữa. Hoàng An"
37,Thể thao,Alcaraz muốn học theo Federer và Murray trên sân cỏ,"""Tôi luôn nói rằng bạn phải di chuyển tốt trên sân cỏ, từ đó mọi thứ sẽ đến"", Alcaraz chia sẻ hôm 21/6, khi tham dự giải ATP 500 Queen's Club. ""Tôi thích xem các video của Federer và Murray, những tay vợt di chuyển tốt bậc nhất trên sân cỏ. Tôi sẽ không nói về Djokovic, bởi anh ấy trượt trên sân cỏ như sân đất nện. Đó không phải phong cách di chuyển hợp với tôi"". Federer giữ kỷ lục tám lần vô địch Wimbledon, trong khi Murray cũng hai lần đăng quang tại Grand Slam sân cỏ và một lần vô địch đơn nam Olympic trên mặt sân này. Djokovic thì đang sở hữu bảy danh hiệu Wimbledon, bao gồm bốn chức vô địch ở bốn năm gần nhất. Alcaraz nhấn mạnh rằng anh sẽ cố gắng bắt chước cách di chuyển của Federer và Murray, nhưng không học theo cách đánh bởi mỗi người đều có phong cách riêng. Tay vợt số hai thế giới cũng tiết lộ bản thân sẽ đánh tấn công và tràn lưới mọi lúc có thể trên mặt sân cỏ. ""Có thể đánh trên sân cỏ sẽ mệt hơn vì bạn phải di chuyển liên tục"", Alcaraz nói thêm. ""Nó hoàn toàn khác với các mặt sân còn lại và tôi sẽ cần tập luyện rất nhiều để thích nghi với nó"". Alcaraz vừa thắng trận đầu tiên trên sân cỏ mùa này, khi hạ Arthur Rinderknech 4-6, 7-5, 7-6 ở vòng một Queen's Club Championships. Anh sẽ đối đầu với Jiri Lehecka dự kiến vào 21h hôm nay 22/6, giờ Hà Nội. Nếu vô địch tại Queen's Club, Alcaraz sẽ trở lại vị trí số một thế giới do đàn anh Djokovic không đánh giải nào từ nay đến trước Wimbledon. Alcaraz đang làm việc cùng trợ lý HLV Samuel Lopez tại Queen's Club, do HLV Juan Carlos Ferrero dành thời gian nghỉ ngơi cùng gia đình. Ferrero, cựu số một thế giới từng hai lần vào tứ kết Wimbledon, sẽ trở lại cùng đội ngũ của Alcaraz trước thềm Grand Slam sân cỏ. Vy Anh"
38,Thể thao,Dani Alves từ chối xin lỗi nạn nhân,"Ngày 20/6, Alves trả lời phỏng vấn độc quyền với ký giả Mayka Navarro và lần đầu tiên lên tiếng từ khi phải ngồi tù vì cáo buộc tấn công tình dục người phụ nữ 23 tuổi tại một hộp đêm ở Barcelona ngày 30/12/2022. ""Tôi nhận lời thực hiện cuộc phỏng vấn này, để lần đầu lên tiếng, để mọi người có cơ hội biết suy nghĩ của tôi"", hậu vệ Brazil giải thích. Theo lời khai của nạn nhân, dù cố chống cự, cô vẫn bị Alves ép quan hệ trong nhà vệ sinh của khu VIP ở hộp đêm Sutton, Barcelona tối 30/12. Sau đó, cô được đưa đến Phòng khám Bệnh viện ở Barcelona, nơi người này được kiểm tra dấu vết bằng chứng sinh học. Tuy nhiên, hậu vệ 39 tuổi khẳng định những câu chuyện đáng sợ và kinh hoàng mà người phụ nữ tố cáo là sai sự thật. Alves cũng mỉa mai người tố cáo anh, khi nói: ""Tôi không biết liệu cô ấy có lương tâm trong sáng hay không, liệu cô ấy có ngủ ngon vào ban đêm hay không. Nhưng tôi tha thứ cho cô ấy"". Cựu hậu vệ của PSG và Barca ngừng lại một lúc, rồi nói tiếp: ""Tôi kêu gọi lương tâm của cô ấy. Không đêm nào tôi được ngủ yên. Không đêm nào. Tôi có lương tâm trong sáng. Tôi chưa bao giờ tự ý làm hại ai cả, và cũng không làm tổn thương cô ấy đêm đó"". Sau đó, Alves lên tiếng về sự việc diễn ra vào đêm 30/12: ""Tôi vào phòng vệ sinh sau cô ấy, và thậm chí không khóa cửa. Cửa lúc nào cũng mở, cô ấy có thể đã rời đi vì tôi hầu như chỉ ngồi trên toilet"". Theo Alves, người phụ nữ 23 tuổi có thể đã nhận lời khuyên tồi tệ hoặc cảm thấy tồi tệ sau những gì đã làm, nên đã tố cáo anh. Sau đó, cô không biết làm thế nào để thoát ra khỏi mớ hỗn độn và buộc phải ""lao theo"" những lời dối trá. Sau khi Alves bị bắt vì cáo buộc tấn công tình dục, vợ của anh - người mẫu Joana Sanz đã nộp đơn ly hôn. Người mẫu Tây Ban Nha cũng dọn khỏi nhà riêng tại Barcelona - theo yêu cầu của Alves, đã chuyển đến Madrid sinh sống và được cho đã bắt đầu mối quan hệ mới với một doanh nhân. Khi được nhà báo Navarro hỏi rằng có phải xin lỗi ai về những gì đã xảy ra không, Alves một lần nữa khẳng định vô tội và nói thêm: ""Người duy nhất tôi phải xin lỗi là vợ tôi, Joana Sanz"". Alves bị bắt giam tại đồn Mossos d'Esquadra de Les Corts, Barcelona sáng 20/1, và bác đơn xin tại ngoại ba lần. Theo El Periodico, vụ án của Alves đã được ấn định ngày xét xử vào mùa thu năm nay, từ tháng 10 đến tháng 11, với thời gian cụ thể vẫn chưa được xác nhận chính thức. Nếu bị kết tội, hậu vệ Brazil có thể phải đối mặt với mức án từ 6 đến 12 năm, theo Luật Bảo đảm Quyền tự do Tình dục có hiệu lực từ tháng 10/2022. Nguồn tin này cho biết các thẩm phán đã xem xét bằng chứng hai lần và đưa ra cùng một kết luận, rằng có một số dấu hiệu chứng thực cho lời khai của nạn nhân và bác bỏ những lời giải thích mà Alves đưa ra. Cảnh sát tìm thấy bảy dấu vân tay của nạn nhân trong bể chứa nước và cả trong bồn rửa. Dấu chân cũng cho thấy một loạt các chuyển động tại hiện trường khớp với hai lời khai của người tố cáo. Hồng Duy"
39,Thể thao,Mỹ chốt danh sách dự World Cup nữ 2023,"Mỹ vắng trung vệ đội trưởng 38 tuổi Becky Sauerbrunn, từng chơi 216 trận cho đội tuyển, vì chấn thương. Tiền đạo Mallory Swanson – ghi 32 bàn sau 88 trận, tiền vệ Sam Mewis và Catarina Macario cũng vắng mặt vì lý do tương tự. HLV Vlatko Andonovski đặt niềm tin vào các cựu binh như tiền đạo Alex Morgan, Kelly O’Hara và Megan Rapinoe. Bộ ba có kỳ World Cup nữ thứ tư liên tiếp, chơi tổng cộng 462 trận cùng 187 bàn cho ĐTQG. Trong đó, Rapinoe sẽ cán mốc 38 tuổi khi World Cup diễn ra. Danh sách tuyển nữ Mỹ có 14 cầu thủ lần đầu góp mặt tại World Cup, trẻ nhất là tiền đạo 18 tuổi Alyssa Thompson. 22 cái tên thi đấu trong nước, riêng tiền vệ Lindsey Horan, 29 tuổi, đang chơi bóng tại Pháp cho CLB Lyon. ""Các cầu thủ yêu thích những thách thức và môi trường cạnh tranh trong đội"", HLV Andonovski nói. ""Đội hình của tôi có chiều sâu và tính linh hoạt để đương đầu với mọi thử thách sắp tới"". Khi danh sách đội tuyển nữ Mỹ dự World Cup 2023 được công bố, một video tổng hợp lời chúc của nhiều nhân vật nổi tiếng dành cho các cầu thủ cũng được đăng tải, trong đó có Tổng thống Mỹ Joe Biden và phu nhân, cựu ngôi sao bóng rổ Shaquille O’Neal, nhạc sĩ – ca sĩ Lil Wayne, Taylor Swift. ""Những nữ cầu thủ này đã trở thành nguồn cảm hứng cho người Mỹ ở mọi lứa tuổi"", Tổng thống Mỹ nói. Mỹ hướng tới chức vô địch World Cup nữ thứ năm sau các chiến thắng năm 1991, 1999, 2015 và 2019. Đội đá trận mở màn vào ngày 22/7 ở Auckland gặp Việt Nam – đội lần đầu dự giải. Sau đó, thầy trò Andonovski lần lượt gặp Hà Lan – đương kim á quân và Bồ Đào Nha. Trong trận mở màn World Cup 2019, Mỹ đè bẹp Thái Lan 13-0, biến đại diện Đông Nam Á thành đội tuyển thua đậm nhất trong lịch sử giải vô địch bóng đá thế giới dành cho nữ. Mỹ là đội vô địch World Cup nhiều nhất (bốn lần), thi đấu nhiều nhất (50 trận), thắng nhiều nhất (44 trận) và ghi nhiều bàn thắng nhất lịch sử giải đấu (138 bàn). Danh sách tuyển nữ Mỹ dự World Cup 2023 Thủ môn (3): Aubrey Kingsbury (Washington Spirit), Casey Murphy (North Carolina Courage), Alyssa Naeher (Chicago Red Stars) Hậu vệ (7): Alana Cook, Sofia Huerta, Emily Sonnett (OL Reign), Crystal Dunn (Portland Thorns FC), Emily Fox (North Carolina Courage), Naomi Girma (San Diego Wave FC), Kelly O’Hara (Gotham FC) Tiền vệ (7): Savannah DeMelo (Racing Louisville FC), Julie Ertz (Angel City FC), Lindsey Horan (Olympique Lyon), Rose Lavelle (OL Reign), Kristie Mewis (Gotham FC), Ashley Sanchez, Andi Sullivan (Washington Spirit) Tiền đạo (6): Alex Morgan (San Diego Wave), Megan Rapinoe (OL Reign), Trinity Rodman (Washington Spirit), Sophia Smith (Portland Thorns), Alyssa Thompson (Angel City FC), Lynn Williams (Gotham FC) Hiếu Lương"
