,Tag,Title,Content
0,Thể thao,CAHN - Hà Tĩnh: Chờ Quang Hải ra mắt,"CAHN chiêu mộ Quang Hải được xem là ""bom tấn"" của kỳ chuyển nhượng giữa mùa V-League 2023. Tiền vệ 26 tuổi trở thành cái tên thứ 15 từng lên ĐTQG hoặc U23 Việt Nam gia nhập đội bóng tân binh của giải, gia tăng sức mạnh chuyên môn bên cạnh hiệu ứng hình ảnh truyền thông. Quang Hải cũng có sợi dây liên kết vô hình với CAHN, khi bố nuôi của anh Vũ Minh Hoàng là em ruột cựu tuyển thủ Vũ Minh Hiếu – biểu tượng của bóng đá ngành công an giai đoạn 1990-2005. Cùng sở hữu lối chơi sáng tạo ở tuyến giữa, Quang Hải được xem là chìa khóa giải quyết điểm yếu của CAHN trong cuộc đua đến ngôi vương. Sau màn ra mắt vào trưa qua 23/6, Quang Hải có buổi tập đầu tiên cùng toàn đội vào chiều cùng ngày. Vì thời gian làm quen ngắn ngủi, CAHN bỏ ngỏ khả năng để Hải thi đấu ngay trận gặp Hà Tĩnh chiều nay 24/6 tại sân Hàng Đẫy ở vòng 12 V-League 2023. Dù vậy, màn trình diễn ấn tượng hơn kỳ vọng ở loạt trận giao hữu cùng đội tuyển Việt Nam có thể cho HLV Flavio Luiz một góc nhìn khác về sự hòa nhập với lối chơi mới của Quang Hải. Sự hiện diện của nhiều tuyển thủ quốc gia ở CAHN là lợi thế cho Quang Hải. Anh có thể vào sân từ ghế dự bị khi đội bóng đảm bảo một tỷ số chiến thắng, mà không ảnh hưởng đến tập thể đã thắng bốn trong năm trận gần nhất và ghi 15 bàn. Tuy nhiên, Hà Tĩnh có đủ yếu tố để trở thành kẻ phá bĩnh trong ngày Quang Hải ra mắt. Vị trí thứ tư V-League là kết quả bất ngờ của thầy trò ông Nguyễn Thành Công, giúp đội sáng cửa nằm trong top tám đua vô địch. Hà Tĩnh nguy hiểm trong phản công, bên cạnh các tình huống cố định khi sở hữu ba ngoại binh Janclesio, Jose Pinto và Diallo Abdoulaye không chiến tốt. Không ngẫu nhiên Hà Tĩnh được xem là hiện tượng với cách chơi khó chịu và tinh thần không bỏ cuộc. Họ chỉ thua sát nút Hà Nội FC, thua ngược Thanh Hóa ở 10 phút cuối, hòa Viettel và thắng cả Hải Phòng lẫn Bình Định. Những kết quả tốt đó cổ vũ HLV Thành Công và học trò kiếm điểm khi hành quân đến Hàng Đẫy, đối đầu CAHN - đội có hàng công mạnh nhất giải với 25 bàn đã ghi từ đầu mùa. Đá cùng giờ với trận CAHN - Hà Tĩnh, Hải Phòng tiếp đội cuối bảng Đà Nẵng đang rất khát điểm ở sân Lạch Tray. Trong khi đó, vào lúc 18h00 tại sân Thiên Trường, Nam Định sẽ trình diện hàng công mới với mục tiêu đánh bại đội đầu bảng Thanh Hóa. Hiếu Lương"
1,Thể thao,Quang Hải và chuyện cầu thủ tái hòa nhập V-League,"Quang Hải xem bến đỗ ở CAHN như trang mới trong sự nghiệp, và anh có lý để nói như vậy. Các cầu thủ Việt Nam khi xuất ngoại thường không thành công, và họ mất nhiều thời gian để thích nghi khi trở lại V-League. Nguyễn Tuấn Anh, Lương Xuân Trường và Đoàn Văn Hậu là những ví dụ như thế. Tuấn Anh dường như không giữ được phong độ sau một năm hiếm khi được ra sân ở Yokohama FC. Trước khi sang Nhật Bản, anh chơi mùa đầu tiên ở V-League, trọn 26 trận. Nhưng khi trở lại năm 2017, Tuấn Anh chỉ đá chín trận ở hai mùa giải tiếp theo do vật lộn với chấn thương và sa sút phong độ. Năm 2021, tiền vệ này tiếp tục chấn thương dài hạn và vắng mặt gần trọn mùa giải. Gần đây anh mới có dấu hiệu khởi sắc trở lại, ở màu áo HAGL lẫn đội tuyển. Tuấn Anh từng là cầu thủ trẻ hay nhất Việt Nam năm 2014, còn Xuân Trường cũng nhận giải Quả Bóng Bạc sau đó hai năm. Sau thời gian chơi bóng không được như kỳ vọng tại Hàn Quốc và Thái Lan, Xuân Trường trở lại HAGL năm 2019. Trong hai mùa giải kế tiếp, anh chỉ chơi 54% số trận tối đa cũng vì thể lực và phong độ sa sút. Việc chuyển đến Hải Phòng cũng chưa giúp tiền vệ người Tuyên Quang cải thiện tình hình. Hai năm đầu trở lại V-League sau khi xuất ngoại cũng là nốt trầm của Văn Hậu. Hậu vệ người Thái Bình chỉ đá đúng hai trận V-League 2020 và 2021, chủ yếu vì chấn thương. Anh tái xuất không tồi mùa 2022, trước khi chuyển sang đội bóng mới CAHN. Với Lê Công Vinh, Nguyễn Công Phượng hay Đặng Văn Lâm, những chuyến xuất ngoại không giúp họ tiến bộ vượt bậc, cũng không suy giảm phong độ đáng kể. Hiệu suất của Công Phượng trước khi rời HAGL lần đầu là 0,24 bàn mỗi trận, rồi anh chuyển tới Mito Hollyhock tại Nhật Bản. Trở lại HAGL hai mùa tiếp theo, Công Phượng cải thiện hiệu suất lên 0,38 bàn mỗi trận. Dù vậy, màn thể hiện của tiền đạo gốc Nghệ An không vượt trội. Công Phượng sau đó tiếp tục chơi cho Incheon United tại Hàn Quốc, rồi Sint-Truiden ở Bỉ nhưng không thành công. Kể từ khi trở lại V-League lần hai, anh đạt hiệu suất 0,43 bàn mỗi trận. Nói cách khác, hiệu suất ghi bàn của Công Phượng tăng dần sau mỗi chuyến xuất ngoại, nhưng không quá lớn. Văn Lâm hay Công Vinh cũng duy trì màn trình diễn ổn định mỗi khi trở lại Việt Nam. Trước và sau khi thi đấu tại Bồ Đào Nha, Công Vinh duy trì được phong độ khoảng 0,6 bàn mỗi trận ở V-League. Thành tích này của anh giảm xuống còn 0,29 bàn mỗi trận sau thời gian chơi ở Nhật Bản, phần nào vì tuổi tác. Không như Xuân Trường, Tuấn Anh hay Văn Hậu, Quang Hải hiếm khi chấn thương dài hạn. Điều này có thể giúp anh tái hòa nhập nhanh hơn với V-League. Vấn đề là liệu anh có thể hiện được phẩm chất vượt trội so với mặt bằng chung V-League, sau thời gian ăn tập ở nền bóng đá hàng đầu. Nhưng bất luận thế nào, Quang Hải cũng là sự bổ sung quan trọng để CAHN hướng tới mục tiêu vô địch. Còn CAHN sẽ là nơi anh tìm lại sự tự tin như những màn trình diễn thời 2018-2019. Xuân Bình"
2,Thể thao,Quốc Hoàng thắng 'nghẹt thở' cơ thủ số năm thế giới,"Quốc Hoàng và Nguyễn Anh Tuấn là hai đại diện Việt Nam vượt qua vòng loại kép, để vào vòng loại trực tiếp gồm 64 cơ thủ. Tại vòng 1/32, Anh Tuấn dừng bước khi thua Marc Bijsterbosch 6-10, còn Quốc Hoàng đi tiếp nhờ chiến thắng trước cơ thủ số 11 thế giới Max Lechner 10-9. Trận đấu tiếp theo của Quốc Hoàng còn kịch tính hơn thế, khi anh gặp cơ thủ số năm thế giới Juszczyszyn. Hai tay cơ rượt đuổi tỷ số, không lúc nào có người dẫn quá một điểm, cho đến khi đại diện Việt Nam vượt lên 8-6. Tuy nhiên, Juszczyszyn thể hiện bản lĩnh nhà vô địch châu Âu 2018, khi thắng liền ba ván tiếp theo để dẫn ngược 9-8. Ở ván thứ 18, cơ thủ Ba Lan nhảy bi quá lực và mắc lỗi, giúp Quốc Hoàng được đặt bi cái trong thế thuận lợi. Nhưng đến bi tám, tay cơ số một Việt Nam mắc sai lầm, dù thế bi sau đó không đủ thuận lợi để đối thủ dứt điểm. Juszczyszyn chạy bi, bi cái và bi tám cách xa nhau với góc đánh hẹp. Tuy nhiên, Quốc Hoàng dứt điểm luôn và đưa bi tám xuống lỗ bằng cú cân băng dài, nhận được tràng pháo tay của khán giả. Anh không bỏ lỡ thời cơ đưa nốt bi chín xuống lỗ, cân bằng tỷ số 9-9. Đến ván đấu quyết định, Quốc Hoàng phá và đưa liên tiếp bi xuống lỗ. Nhưng đến bi bảy thuận lợi, anh lại đánh lắc lỗ. Juszczyszyn đưa bi bảy xuống lỗ, nhưng kéo bi cái quá mạnh nên mất góc dứt điểm thuận lợi, khiến anh lắc đầu ngao ngán. Cơ thủ Ba Lan vẫn cố gắng chém má bi tám về lỗ góc nhưng lắc lỗ. Bi tám nằm ngay cửa lỗ, còn Juszczyszyn trở về ghế ngồi, liên tục đấm tay này vào tay kia. Dĩ nhiên Quốc Hoàng không bỏ lỡ thế bi quá thuận lợi để thắng 10-9 và vào vòng 1/8 với 16 cơ thủ. Anh sẽ đánh với tài năng trẻ 22 tuổi Sanjin Pehlivanovic, cũng là tay cơ số bảy thế giới, trong ngày 24/6. ""Đến lúc này tôi vẫn còn thấy xốn xang"", Quốc Hoàng nói sau trận. ""Tôi sẽ không bao giờ quên trận đấu này và những áp lực trong đó. Hôm nay, tôi thấy mình rất may mắn"". Tây Ban Nha Mở rộng quy tụ hầu hết cơ thủ Top 100 thế giới, diễn ra từ 20/6 đến 25/6 tại thành phố Lugo, Tây Ban Nha. Nhà vô địch sẽ nhận 30.000 USD tiền thưởng, còn Quốc Hoàng đã đảm bảo nhận ít nhất 4.000 USD. Xuân Bình"
3,Thể thao,Messi thừa nhận rạn nứt với fan PSG,"Trên tờ AS hôm 23/6, Messi kể lại những năm tháng anh gắn bó với PSG. Anh cho biết, khi hồi ban đầu, mọi chuyện diễn ra rất tốt nhưng sau đó một bộ phận CĐV bắt đầu thay đổi. ""Có sự rạn nứt với một bộ phận fan PSG"", Messi nói. ""Nhưng đó là cách đối xử của họ. Neymar và Mbappe cũng từng bị như vậy. Tôi chỉ giữ kỷ niệm với những người đã ủng hộ tôi"". Tiền đạo người Argentina cũng cho biết sau khi rời Barca, anh chọn PSG vì thích CLB nước Pháp. Một phần khác, anh coi trọng mối quan hệ với Neymar và sự quen biết với nhiều cầu thủ PSG. Tuy nhiên, giai đoạn thích nghi khó hơn anh tưởng tượng. ""Tôi gia nhập muộn và không có giai đoạn tiền mùa giải"", Messi cho hay. ""Tôi và gia đình phải thích nghi một cách khó khăn với một thành phố mới. Điều đó thật phức tạp"". Hồi tháng 8/2021, Messi gia nhập PSG ngay sau khi bị Barca từ chối gia hạn hợp đồng. Anh không có nhiều thời gian để chọn lựa CLB như những cầu thủ chuyển nhượng tự do khác. Tuy nhiên, Messi vẫn đạt phong độ tích cực. Mùa đầu tiên, anh góp 11 bàn và 15 kiến tạo trong 39 trận. Mùa tiếp theo, thành tích tăng lên 20 bàn và 21 kiến tạo trong 41 trận. Anh giành được hai Ligue 1 và một Siêu Cup Pháp. Mối quan hệ giữa Messi và fan PSG bắt đầu xấu đi từ đầu năm 2023. Sau thất bại ở vòng 1/8 Champions League lần thứ hai liên tiếp, một bộ phận CĐV chỉ trích Messi. Những trận cuối mùa, nhóm fan cuồng liên tục la ó nhà vô địch World Cup 2022. Quan hệ giữa các bên cũng căng thẳng sau sự kiện Messi sang Arab Saudi quảng bá du lịch đầu tháng 5. Messi lên kế hoạch cho việc này từ trước, nhưng PSG bắt các cầu thủ tập ngay sau trận thua Lorient ở Ligue I. Messi đăng video xin lỗi sau chuyến đi, cho biết đã hoãn một lần và không thể làm khác. Messi không gia hạn sau khi hết hợp đồng hai năm với PSG. Anh từ chối trở lại Barca, và khẳng định chưa nhận được lời mời chính thức. Để tránh tình trạng bị đẩy vào thế bị động như trước, tiền đạo 35 tuổi chọn Inter Miami làm điểm đến tiếp theo. CLB Mỹ do cựu danh thủ David Beckham thành lập vào năm 2018. Ngày 21/7, Messi có thể ra mắt Inter Miami trong trận giao hữu với Cruz Azul, Mexico. Thanh Quý (theo AS)"
4,Thể thao,Busquets tái hợp Messi ở Inter Miami,"Chiều 23/6 theo giờ Washington, Inter Miami đăng tải đoạn video ngắn trên Twitter dẫn lại lời khen từ HLV Vicente del Bosque, Pep Guardiola, Xavi hay tiền vệ Real Madrid Luka Modric. Đến cuối video, Inter Miami xác nhận ký hợp đồng với Busquets bằng dòng chữ ""Busi"" - biệt danh của tiền vệ Tây Ban Nha theo phong cách phun sơn graffiti. Đầu tháng 5, Busquets xác nhận chia tay Barca khi hết hợp đồng, bất chấp HLV Xavi thuyết phục ở lại thêm một năm. Tiền vệ 34 tuổi từ chối nhiều đề nghị lương khủng từ Arab Saudi để gia nhập Inter Miami và tái hợp bạn thân Messi. Hợp đồng giữa đôi bên có thời hạn đến hè 2025, kèm tùy chọn gia hạn một năm. Busquets, từ khi lên đội một Barca năm 2008, thi đấu cùng Messi tại Camp Nou cho đến khi ngôi sao Argentina gia nhập PSG theo dạng tự do hè 2021. Bộ đôi ngôi sao này cùng nhau đoạt mọi danh hiệu cùng Barca, gồm ba Champions League năm 2009, 2011 và 2015. Ngoài Messi và Busquets, Inter Miami có thể chiêu mộ một cựu cầu thủ khác của Barca là Jordi Alba. Tương tự Busquets, hậu vệ Tây Ban Nha thông báo rời sân Camp Nou khi kỳ chuyển nhượng mở cửa từ tháng trước. Theo ESPN, sau khi cùng tuyển Tây Ban Nha vô địch UEFA Nations League, Alba sẽ chốt tương lai trong vài tuần tới. Ngoài Inter Miami, hậu vệ 34 tuổi còn nhận được đề nghị từ Atletico Madrid, Inter Milan và các CLB Arab Saudi. Ngày 19/6, đồng sở hữu Inter Miami, ông Jorge Mas đã làm dấy lên tin đồn Alba có thể sắp tái hợp với Busquets và Messi khi đăng trên Twitter hình ảnh ba chiếc áo đấu màu hồng của CLB MLS, cùng thông điệp ""sắp ra mắt"" và hashtag ""không cần chú thích"". Đại diện của Mỹ còn nhắm tới một cựu cầu thủ Barca khác là Luis Suarez. Nhưng thương vụ khó xảy ra bởi tiền đạo Urguay còn hợp đồng với CLB Brazil Gremio đến tháng 12/2024, và được cho đang cân nhắc giải nghệ ở tuổi 36 vì chấn thương đầu gối dai dẳng. Inter Miami được cho ngắm tới cả Angel Di Maria - đồng đội của Messi trên tuyển Argentina. Nhưng tiền đạo cánh 35 tuổi này được cho đã đạt thỏa thuận để trở lại Benfica sau khi hết hợp đồng với Juventus ngày 30/6. Hồng Duy"
5,Thể thao,Alcaraz vào bán kết Queen's Club,"Thắng lợi trước Dimitrov là lần đầu Alcaraz hạ được một đối thủ top 30 trên sân cỏ. Trong chín sự kiện tham dự mùa này, tay vợt 20 tuổi tám lần vào bán kết hoặc xa hơn. Thành tích sân cỏ của Alcaraz trong sự nghiệp cũng được cải thiện thành năm thắng - bốn thua. Tay vợt Tây Ban Nha thắng game đỡ bóng đầu tiên trong trận, rồi cứu ba break-point trong set đầu để thắng 6-4. Sang set hai, Alcaraz bị dẫn 0-3 nhưng thắng liền hai game đỡ bóng để dẫn ngược 4-3, trước khi thua game giao kế tiếp. Nhưng ở game bản lề của Dimitrov, Alcaraz chơi xuất sắc để thắng trắng, trước khi khép lại set hai cũng với tỷ số 6-4. Duy trì thành tích toàn thắng ở tám trận tứ kết ATP mùa này, Alcaraz vào bán kết gặp Sebastian Korda - người loại niềm hy vọng chủ nhà Cameron Norrie với tỷ số 6-4, 7-6. Cặp bán kết còn lại là cuộc đọ sức giữa Holger Rune và Alex De Minaur. Bốn tay vợt còn ở lại giải đấu đều dưới 25 tuổi. ""Thật tuyệt khi được đối đầu với những tay vợt trẻ như tôi,"" Alcaraz nói khi được biết về thống kê kể trên. ""Chúng tôi đang thiết lập thế hệ mới và sẽ chơi rất nhiều trận đấu tại các sự kiện lớn, các giải đấu lớn"". Tại giải ATP 500 ở Halle, Đức, Daniil Medvedev thất bại sau hai set trước Roberto Bautista Agut với tỷ số 5-7, 6-7. Bautista Agut, 35 tuổi, từng vào bán kết ở cả Halle và Wimbledon. Anh sẽ đối đầu với Andrey Rublev ở bán kết. Trận bán kết còn lại là cuộc đọ sức giữa Alexander Zverev và Alexander Bublik - người đi tiếp sau khi Jannik Sinner bỏ cuộc vì chấn thương. Vy Anh"
6,Thể thao,HLV Mai Đức Chung: 'Gặp tuyển Đức chủ yếu để học hỏi',"Việt Nam chạm trán Đức tại SVĐ Bieberer Berg lúc 18h15 giờ Berlin, tức 23h15 giờ Hà Nội hôm nay 24/6. Đức hiện đứng thứ hai trên bảng thứ bậc các đội tuyển nữ FIFA, hơn Việt Nam 30 bậc, nhưng được xếp ở đẳng cấp hoàn toàn khác biệt. Họ từng hai lần vô địch World Cup 2003 và 2007, giành HC vàng Olympic 2016 cùng tám lần vô địch Euro. ""Việt Nam gặp Đức chủ yếu để học hỏi"", HLV Mai Đức Chung nói ở họp báo trước trận vào tối 23/6. ""Tôi biết trình độ Đức cao hơn Việt Nam rất nhiều, nên mục tiêu chính ở trận này chỉ là cọ xát để khi vào World Cup sắp tới, chúng ta sẽ bớt đi phần nào khó khăn khi gặp Mỹ, Hà Lan"". Tuyển nữ Việt Nam tập huấn tại Đức và Ba Lan từ đầu tháng 6. Đội đá ba trận giao hữu, lần lượt thắng đội trẻ Frankfurt 2-1, thắng CLB hạng ba Đức Schott Mainz 2-0 và thua U23 Ba Lan 1-2. HLV Mai Đức Chung cho biết các cầu thủ Việt Nam tiến bộ hơn khi va chạm đối thủ có trình độ, lại to cao và giàu thể lực. Trong khi đó, tiền đạo Phạm Hải Yến tự tin rằng quá trình chuẩn bị vừa qua sẽ giúp đội tuyển thi đấu tốt nhất. ""Chúng tôi không lơ là, mà tập trung cho trận đấu quan trọng nhất ở chuyến tập huấn"", Hải Yến cho hay. ""Hy vọng đội sẽ ghi được ít nhất một bàn để tri ân khán giả"". Trong đợt tập huấn ở châu Âu hiện tại, Việt Nam tập trung cải thiện tốc độ và thể lực, tăng khả năng gây áp lực lên đối phương. Hệ thống phòng ngự đồng bộ được rèn luyện thêm sẵn sàng kiểm chứng thông qua trận đấu với đối thủ mạnh như Đức. Đội cũng vừa được tăng cường HLV thể lực Cedric Roger sau khi tuyển nam Việt Nam kết thúc đợt giao hữu gặp Hong Kong và Syria. Một năm trước, Việt Nam từng thua Pháp - đội đứng hạng năm thế giới - với tỷ số 0-7 ở trận giao hữu. Đó là lần hiếm hoi các cầu thủ được chạm trán với phong cách châu Âu, làm bài học kinh nghiệm cho trận đấu tối nay. Ở trận gặp Đức, Việt Nam sẽ vắng Huỳnh Như - tiền đạo đội trưởng chấn thương cổ chân trong trận thua U23 Ba Lan, chỉ kịp hồi phục ngay trước thềm World Cup 2023. Sau trận, tuyển nữ Việt Nam sẽ về nước ít ngày rồi sang New Zealand tập huấn tiếp vào đầu tháng 7, đá giao hữu hai trận - gặp đội chủ nhà và Tây Ban Nha - trước khi dự World Cup. Hiếu Lương"
